{"identifier": "createTranslatedShape", "parameters": "(Shape shape,\n                                              RectangleAnchor anchor,\n                                              double locationX,\n                                              double locationY)", "modifiers": "public static", "return": "Shape", "body": "public static Shape createTranslatedShape(Shape shape,\n                                              RectangleAnchor anchor,\n                                              double locationX,\n                                              double locationY) {\n        if (shape == null) {\n            throw new IllegalArgumentException(\"Null 'shape' argument.\");\n        }\n        if (anchor == null) {\n            throw new IllegalArgumentException(\"Null 'anchor' argument.\");\n        }\n        Point2D anchorPoint = RectangleAnchor.coordinates(shape.getBounds2D(),\n                anchor);\n        AffineTransform transform = AffineTransform.getTranslateInstance(\n                locationX - anchorPoint.getX(), locationY - anchorPoint.getY());\n        return transform.createTransformedShape(shape);\n    }", "class": "ShapeUtilities", "signature": "Shape createTranslatedShape(Shape shape,\n                                              RectangleAnchor anchor,\n                                              double locationX,\n                                              double locationY)", "full_signature": "public static Shape createTranslatedShape(Shape shape,\n                                              RectangleAnchor anchor,\n                                              double locationX,\n                                              double locationY)", "class_method_signature": "ShapeUtilities.createTranslatedShape(Shape shape,\n                                              RectangleAnchor anchor,\n                                              double locationX,\n                                              double locationY)", "testcase": false, "constructor": false, "invocations": ["coordinates", "getBounds2D", "getTranslateInstance", "getX", "getY", "createTransformedShape"]}