{"identifier": "get", "parameters": "(final String name)", "modifiers": "public", "return": "String", "body": "public String get(final String name) {\n        if (mapping == null) {\n            throw new IllegalStateException(\n                    \"No header mapping was specified, the record values can't be accessed by name\");\n        }\n        final Integer index = mapping.get(name);\n        try {\n            return index != null ? values[index.intValue()] : null;\n        } catch (ArrayIndexOutOfBoundsException e) {\n            throw new IllegalArgumentException(\n                    String.format(\n                            \"Index for header '%s' is %d but CSVRecord only has %d values!\",\n                            name, index.intValue(), values.length));\n        }\n    }", "class": "CSVRecord", "signature": "String get(final String name)", "full_signature": "public String get(final String name)", "class_method_signature": "CSVRecord.get(final String name)", "testcase": false, "constructor": false, "invocations": ["get", "intValue", "format", "intValue"]}