{"identifier": "findRangeBounds", "parameters": "(XYDataset dataset,\n            List visibleSeriesKeys, Range xRange, boolean includeInterval)", "modifiers": "public static", "return": "Range", "body": "public static Range findRangeBounds(XYDataset dataset,\n            List visibleSeriesKeys, Range xRange, boolean includeInterval) {\n        if (dataset == null) {\n            throw new IllegalArgumentException(\"Null 'dataset' argument.\");\n        }\n        Range result = null;\n        if (dataset instanceof XYRangeInfo) {\n            XYRangeInfo info = (XYRangeInfo) dataset;\n            result = info.getRangeBounds(visibleSeriesKeys, xRange,\n                    includeInterval);\n        }\n        else {\n            result = iterateToFindRangeBounds(dataset, visibleSeriesKeys,\n                    xRange, includeInterval);\n        }\n        return result;\n    }", "class": "DatasetUtilities", "signature": "Range findRangeBounds(XYDataset dataset,\n            List visibleSeriesKeys, Range xRange, boolean includeInterval)", "full_signature": "public static Range findRangeBounds(XYDataset dataset,\n            List visibleSeriesKeys, Range xRange, boolean includeInterval)", "class_method_signature": "DatasetUtilities.findRangeBounds(XYDataset dataset,\n            List visibleSeriesKeys, Range xRange, boolean includeInterval)", "testcase": false, "constructor": false, "invocations": ["getRangeBounds", "iterateToFindRangeBounds"]}