{"identifier": "getCategoriesForAxis", "parameters": "(CategoryAxis axis)", "modifiers": "public", "return": "List", "body": "public List getCategoriesForAxis(CategoryAxis axis) {\n        List result = new ArrayList();\n        int axisIndex = this.domainAxes.indexOf(axis);\n        List datasets = datasetsMappedToDomainAxis(axisIndex);\n        Iterator iterator = datasets.iterator();\n        while (iterator.hasNext()) {\n            CategoryDataset dataset = (CategoryDataset) iterator.next();\n            // add the unique categories from this dataset\n            for (int i = 0; i < dataset.getColumnCount(); i++) {\n                Comparable category = dataset.getColumnKey(i);\n                if (!result.contains(category)) {\n                    result.add(category);\n                }\n            }\n        }\n        return result;\n    }", "class": "CategoryPlot", "signature": "List getCategoriesForAxis(CategoryAxis axis)", "full_signature": "public List getCategoriesForAxis(CategoryAxis axis)", "class_method_signature": "CategoryPlot.getCategoriesForAxis(CategoryAxis axis)", "testcase": false, "constructor": false, "invocations": ["indexOf", "datasetsMappedToDomainAxis", "iterator", "hasNext", "next", "getColumnCount", "getColumnKey", "contains", "add"]}