{"identifier": "findDomainBounds", "parameters": "(XYDataset dataset,\n            List visibleSeriesKeys, boolean includeInterval)", "modifiers": "public static", "return": "Range", "body": "public static Range findDomainBounds(XYDataset dataset,\n            List visibleSeriesKeys, boolean includeInterval) {\n        if (dataset == null) {\n            throw new IllegalArgumentException(\"Null 'dataset' argument.\");\n        }\n        Range result = null;\n        if (dataset instanceof XYDomainInfo) {\n            XYDomainInfo info = (XYDomainInfo) dataset;\n            result = info.getDomainBounds(visibleSeriesKeys, includeInterval);\n        }\n        else {\n            result = iterateToFindDomainBounds(dataset, visibleSeriesKeys,\n                    includeInterval);\n        }\n        return result;\n    }", "class": "DatasetUtilities", "signature": "Range findDomainBounds(XYDataset dataset,\n            List visibleSeriesKeys, boolean includeInterval)", "full_signature": "public static Range findDomainBounds(XYDataset dataset,\n            List visibleSeriesKeys, boolean includeInterval)", "class_method_signature": "DatasetUtilities.findDomainBounds(XYDataset dataset,\n            List visibleSeriesKeys, boolean includeInterval)", "testcase": false, "constructor": false, "invocations": ["getDomainBounds", "iterateToFindDomainBounds"]}