{"identifier": "drawDomainLine", "parameters": "(Graphics2D g2, CategoryPlot plot,\n            Rectangle2D dataArea, double value, Paint paint, Stroke stroke)", "modifiers": "public", "return": "void", "body": "public void drawDomainLine(Graphics2D g2, CategoryPlot plot,\n            Rectangle2D dataArea, double value, Paint paint, Stroke stroke) {\n\n        if (paint == null) {\n            throw new IllegalArgumentException(\"Null 'paint' argument.\");\n        }\n        if (stroke == null) {\n            throw new IllegalArgumentException(\"Null 'stroke' argument.\");\n        }\n        Line2D line = null;\n        PlotOrientation orientation = plot.getOrientation();\n\n        if (orientation == PlotOrientation.HORIZONTAL) {\n            line = new Line2D.Double(dataArea.getMinX(), value,\n                    dataArea.getMaxX(), value);\n        }\n        else if (orientation == PlotOrientation.VERTICAL) {\n            line = new Line2D.Double(value, dataArea.getMinY(), value,\n                    dataArea.getMaxY());\n        }\n\n        g2.setPaint(paint);\n        g2.setStroke(stroke);\n        g2.draw(line);\n\n    }", "class": "AbstractCategoryItemRenderer", "signature": "void drawDomainLine(Graphics2D g2, CategoryPlot plot,\n            Rectangle2D dataArea, double value, Paint paint, Stroke stroke)", "full_signature": "public void drawDomainLine(Graphics2D g2, CategoryPlot plot,\n            Rectangle2D dataArea, double value, Paint paint, Stroke stroke)", "class_method_signature": "AbstractCategoryItemRenderer.drawDomainLine(Graphics2D g2, CategoryPlot plot,\n            Rectangle2D dataArea, double value, Paint paint, Stroke stroke)", "testcase": false, "constructor": false, "invocations": ["getOrientation", "getMinX", "getMaxX", "getMinY", "getMaxY", "setPaint", "setStroke", "draw"]}