{"identifier": "findMaximumRangeValue", "parameters": "(XYDataset dataset)", "modifiers": "public static", "return": "Number", "body": "public static Number findMaximumRangeValue(XYDataset dataset) {\n\n        if (dataset == null) {\n            throw new IllegalArgumentException(\"Null 'dataset' argument.\");\n        }\n\n        // work out the minimum value...\n        if (dataset instanceof RangeInfo) {\n            RangeInfo info = (RangeInfo) dataset;\n            return new Double(info.getRangeUpperBound(true));\n        }\n\n        // hasn't implemented RangeInfo, so we'll have to iterate...\n        else  {\n\n            double maximum = Double.NEGATIVE_INFINITY;\n            int seriesCount = dataset.getSeriesCount();\n            for (int series = 0; series < seriesCount; series++) {\n                int itemCount = dataset.getItemCount(series);\n                for (int item = 0; item < itemCount; item++) {\n                    double value;\n                    if (dataset instanceof IntervalXYDataset) {\n                        IntervalXYDataset intervalXYData\n                            = (IntervalXYDataset) dataset;\n                        value = intervalXYData.getEndYValue(series, item);\n                    }\n                    else if (dataset instanceof OHLCDataset) {\n                        OHLCDataset highLowData = (OHLCDataset) dataset;\n                        value = highLowData.getHighValue(series, item);\n                    }\n                    else {\n                        value = dataset.getYValue(series, item);\n                    }\n                    if (!Double.isNaN(value)) {\n                        maximum = Math.max(maximum, value);\n                    }\n                }\n            }\n            if (maximum == Double.NEGATIVE_INFINITY) {\n                return null;\n            }\n            else {\n                return new Double(maximum);\n            }\n\n        }\n\n    }", "class": "DatasetUtilities", "signature": "Number findMaximumRangeValue(XYDataset dataset)", "full_signature": "public static Number findMaximumRangeValue(XYDataset dataset)", "class_method_signature": "DatasetUtilities.findMaximumRangeValue(XYDataset dataset)", "testcase": false, "constructor": false, "invocations": ["getRangeUpperBound", "getSeriesCount", "getItemCount", "getEndYValue", "getHighValue", "getYValue", "isNaN", "max"]}