{"identifier": "clearDomainMarkers", "parameters": "()", "modifiers": "public", "return": "void", "body": "public void clearDomainMarkers() {\n        if (this.backgroundDomainMarkers != null) {\n            Set keys = this.backgroundDomainMarkers.keySet();\n            Iterator iterator = keys.iterator();\n            while (iterator.hasNext()) {\n                Integer key = (Integer) iterator.next();\n                clearDomainMarkers(key.intValue());\n            }\n            this.backgroundDomainMarkers.clear();\n        }\n        if (this.foregroundDomainMarkers != null) {\n            Set keys = this.foregroundDomainMarkers.keySet();\n            Iterator iterator = keys.iterator();\n            while (iterator.hasNext()) {\n                Integer key = (Integer) iterator.next();\n                clearDomainMarkers(key.intValue());\n            }\n            this.foregroundDomainMarkers.clear();\n        }\n        notifyListeners(new PlotChangeEvent(this));\n    }", "class": "CategoryPlot", "signature": "void clearDomainMarkers()", "full_signature": "public void clearDomainMarkers()", "class_method_signature": "CategoryPlot.clearDomainMarkers()", "testcase": false, "constructor": false, "invocations": ["keySet", "iterator", "hasNext", "next", "clearDomainMarkers", "intValue", "clear", "keySet", "iterator", "hasNext", "next", "clearDomainMarkers", "intValue", "clear", "notifyListeners"]}