{"identifier": "addAnnotation", "parameters": "(CategoryAnnotation annotation, Layer layer)", "modifiers": "public", "return": "void", "body": "public void addAnnotation(CategoryAnnotation annotation, Layer layer) {\n        if (annotation == null) {\n            throw new IllegalArgumentException(\"Null 'annotation' argument.\");\n        }\n        if (layer.equals(Layer.FOREGROUND)) {\n            this.foregroundAnnotations.add(annotation);\n            notifyListeners(new RendererChangeEvent(this));\n        }\n        else if (layer.equals(Layer.BACKGROUND)) {\n            this.backgroundAnnotations.add(annotation);\n            notifyListeners(new RendererChangeEvent(this));\n        }\n        else {\n            // should never get here\n            throw new RuntimeException(\"Unknown layer.\");\n        }\n    }", "class": "AbstractCategoryItemRenderer", "signature": "void addAnnotation(CategoryAnnotation annotation, Layer layer)", "full_signature": "public void addAnnotation(CategoryAnnotation annotation, Layer layer)", "class_method_signature": "AbstractCategoryItemRenderer.addAnnotation(CategoryAnnotation annotation, Layer layer)", "testcase": false, "constructor": false, "invocations": ["equals", "add", "notifyListeners", "equals", "add", "notifyListeners"]}