{"identifier": "findMinimumRangeValue", "parameters": "(CategoryDataset dataset)", "modifiers": "public static", "return": "Number", "body": "public static Number findMinimumRangeValue(CategoryDataset dataset) {\n\n        if (dataset == null) {\n            throw new IllegalArgumentException(\"Null 'dataset' argument.\");\n        }\n\n        if (dataset instanceof RangeInfo) {\n            RangeInfo info = (RangeInfo) dataset;\n            return new Double(info.getRangeLowerBound(true));\n        }\n\n        // hasn't implemented RangeInfo, so we'll have to iterate...\n        else {\n            double minimum = Double.POSITIVE_INFINITY;\n            int seriesCount = dataset.getRowCount();\n            int itemCount = dataset.getColumnCount();\n            for (int series = 0; series < seriesCount; series++) {\n                for (int item = 0; item < itemCount; item++) {\n                    Number value;\n                    if (dataset instanceof IntervalCategoryDataset) {\n                        IntervalCategoryDataset icd\n                                = (IntervalCategoryDataset) dataset;\n                        value = icd.getStartValue(series, item);\n                    }\n                    else {\n                        value = dataset.getValue(series, item);\n                    }\n                    if (value != null) {\n                        minimum = Math.min(minimum, value.doubleValue());\n                    }\n                }\n            }\n            if (minimum == Double.POSITIVE_INFINITY) {\n                return null;\n            }\n            else {\n                return new Double(minimum);\n            }\n\n        }\n\n    }", "class": "DatasetUtilities", "signature": "Number findMinimumRangeValue(CategoryDataset dataset)", "full_signature": "public static Number findMinimumRangeValue(CategoryDataset dataset)", "class_method_signature": "DatasetUtilities.findMinimumRangeValue(CategoryDataset dataset)", "testcase": false, "constructor": false, "invocations": ["getRangeLowerBound", "getRowCount", "getColumnCount", "getStartValue", "getValue", "min", "doubleValue"]}