{"identifier": "get", "parameters": "(final String name)", "modifiers": "public", "return": "String", "body": "public String get(final String name) {\n        if (mapping == null) {\n            throw new IllegalStateException(\n                    \"No header mapping was specified, the record values can't be accessed by name\");\n        }\n        final Integer index = mapping.get(name);\n        if (index == null) {\n            throw new IllegalArgumentException(String.format(\"Mapping for %s not found, expected one of %s\", name,\n                    mapping.keySet()));\n        }\n        try {\n            return values[index.intValue()];\n        } catch (final ArrayIndexOutOfBoundsException e) {\n            throw new IllegalArgumentException(String.format(\n                    \"Index for header '%s' is %d but CSVRecord only has %d values!\", name, index,\n                    Integer.valueOf(values.length)));\n        }\n    }", "class": "CSVRecord", "signature": "String get(final String name)", "full_signature": "public String get(final String name)", "class_method_signature": "CSVRecord.get(final String name)", "testcase": false, "constructor": false, "invocations": ["get", "format", "keySet", "intValue", "format", "valueOf"]}