{"identifier": "getLegendItem", "parameters": "(int datasetIndex, int series)", "modifiers": "public", "return": "LegendItem", "body": "public LegendItem getLegendItem(int datasetIndex, int series) {\n\n        CategoryPlot p = getPlot();\n        if (p == null) {\n            return null;\n        }\n\n        // check that a legend item needs to be displayed...\n        if (!isSeriesVisible(series) || !isSeriesVisibleInLegend(series)) {\n            return null;\n        }\n\n        CategoryDataset dataset = p.getDataset(datasetIndex);\n        String label = this.legendItemLabelGenerator.generateLabel(dataset,\n                series);\n        String description = label;\n        String toolTipText = null;\n        if (this.legendItemToolTipGenerator != null) {\n            toolTipText = this.legendItemToolTipGenerator.generateLabel(\n                    dataset, series);\n        }\n        String urlText = null;\n        if (this.legendItemURLGenerator != null) {\n            urlText = this.legendItemURLGenerator.generateLabel(dataset,\n                    series);\n        }\n        Shape shape = lookupLegendShape(series);\n        Paint paint = lookupSeriesPaint(series);\n        Paint outlinePaint = lookupSeriesOutlinePaint(series);\n        Stroke outlineStroke = lookupSeriesOutlineStroke(series);\n\n        LegendItem item = new LegendItem(label, description, toolTipText,\n                urlText, shape, paint, outlineStroke, outlinePaint);\n        item.setLabelFont(lookupLegendTextFont(series));\n        Paint labelPaint = lookupLegendTextPaint(series);\n        if (labelPaint != null) {\n            item.setLabelPaint(labelPaint);\n        }\n        item.setSeriesKey(dataset.getRowKey(series));\n        item.setSeriesIndex(series);\n        item.setDataset(dataset);\n        item.setDatasetIndex(datasetIndex);\n        return item;\n    }", "class": "AbstractCategoryItemRenderer", "signature": "LegendItem getLegendItem(int datasetIndex, int series)", "full_signature": "public LegendItem getLegendItem(int datasetIndex, int series)", "class_method_signature": "AbstractCategoryItemRenderer.getLegendItem(int datasetIndex, int series)", "testcase": false, "constructor": false, "invocations": ["getPlot", "isSeriesVisible", "isSeriesVisibleInLegend", "getDataset", "generateLabel", "generateLabel", "generateLabel", "lookupLegendShape", "lookupSeriesPaint", "lookupSeriesOutlinePaint", "lookupSeriesOutlineStroke", "setLabelFont", "lookupLegendTextFont", "lookupLegendTextPaint", "setLabelPaint", "setSeriesKey", "getRowKey", "setSeriesIndex", "setDataset", "setDatasetIndex"]}