{"identifier": "addRangeMarker", "parameters": "(int index, Marker marker, Layer layer,\n    \t\tboolean notify)", "modifiers": "public", "return": "void", "body": "public void addRangeMarker(int index, Marker marker, Layer layer,\n    \t\tboolean notify) {\n        Collection markers;\n        if (layer == Layer.FOREGROUND) {\n            markers = (Collection) this.foregroundRangeMarkers.get(\n                    new Integer(index));\n            if (markers == null) {\n                markers = new java.util.ArrayList();\n                this.foregroundRangeMarkers.put(new Integer(index), markers);\n            }\n            markers.add(marker);\n        }\n        else if (layer == Layer.BACKGROUND) {\n            markers = (Collection) this.backgroundRangeMarkers.get(\n                    new Integer(index));\n            if (markers == null) {\n                markers = new java.util.ArrayList();\n                this.backgroundRangeMarkers.put(new Integer(index), markers);\n            }\n            markers.add(marker);            \n        }\n        marker.addChangeListener(this);\n        if (notify) {\n            fireChangeEvent();\n        }\n    }", "class": "CategoryPlot", "signature": "void addRangeMarker(int index, Marker marker, Layer layer,\n    \t\tboolean notify)", "full_signature": "public void addRangeMarker(int index, Marker marker, Layer layer,\n    \t\tboolean notify)", "class_method_signature": "CategoryPlot.addRangeMarker(int index, Marker marker, Layer layer,\n    \t\tboolean notify)", "testcase": false, "constructor": false, "invocations": ["get", "put", "add", "get", "put", "add", "addChangeListener", "fireChangeEvent"]}