{"identifier": "initialise", "parameters": "(Graphics2D g2,\n            Rectangle2D dataArea, CategoryPlot plot, CategoryDataset dataset,\n            PlotRenderingInfo info)", "modifiers": "public", "return": "CategoryItemRendererState", "body": "public CategoryItemRendererState initialise(Graphics2D g2,\n            Rectangle2D dataArea, CategoryPlot plot, CategoryDataset dataset,\n            PlotRenderingInfo info) {\n\n        setPlot(plot);\n        if (dataset != null) {\n            this.rowCount = dataset.getRowCount();\n            this.columnCount = dataset.getColumnCount();\n        }\n        else {\n            this.rowCount = 0;\n            this.columnCount = 0;\n        }\n        CategoryItemRendererState state = createState(info);\n\n        // determine if there is any selection state for the dataset\n        CategoryDatasetSelectionState selectionState = null;\n        if (dataset instanceof SelectableCategoryDataset) {\n            SelectableCategoryDataset scd = (SelectableCategoryDataset) dataset;\n            selectionState = scd.getSelectionState();\n        }\n        // if the selection state is still null, go to the selection source\n        // and ask if it has state...\n        if (selectionState == null && info != null) {\n            ChartRenderingInfo cri = info.getOwner();\n            if (cri != null) {\n                RenderingSource rs = cri.getRenderingSource();\n                selectionState = (CategoryDatasetSelectionState)\n                        rs.getSelectionState(dataset);\n            }\n        }\n        state.setSelectionState(selectionState);\n\n        return state;\n    }", "class": "AbstractCategoryItemRenderer", "signature": "CategoryItemRendererState initialise(Graphics2D g2,\n            Rectangle2D dataArea, CategoryPlot plot, CategoryDataset dataset,\n            PlotRenderingInfo info)", "full_signature": "public CategoryItemRendererState initialise(Graphics2D g2,\n            Rectangle2D dataArea, CategoryPlot plot, CategoryDataset dataset,\n            PlotRenderingInfo info)", "class_method_signature": "AbstractCategoryItemRenderer.initialise(Graphics2D g2,\n            Rectangle2D dataArea, CategoryPlot plot, CategoryDataset dataset,\n            PlotRenderingInfo info)", "testcase": false, "constructor": false, "invocations": ["setPlot", "getRowCount", "getColumnCount", "createState", "getSelectionState", "getOwner", "getRenderingSource", "getSelectionState", "setSelectionState"]}