{"identifier": "drawItem", "parameters": "(Graphics2D g2,\n                         CategoryItemRendererState state,\n                         Rectangle2D dataArea,\n                         CategoryPlot plot,\n                         CategoryAxis domainAxis,\n                         ValueAxis rangeAxis,\n                         CategoryDataset data,\n                         int row,\n                         int column,\n                         int pass)", "modifiers": "public", "return": "void", "body": "public void drawItem(Graphics2D g2,\n                         CategoryItemRendererState state,\n                         Rectangle2D dataArea,\n                         CategoryPlot plot,\n                         CategoryAxis domainAxis,\n                         ValueAxis rangeAxis,\n                         CategoryDataset data,\n                         int row,\n                         int column,\n                         int pass) {\n\n        // defensive check\n        if (!(data instanceof StatisticalCategoryDataset)) {\n            throw new IllegalArgumentException(\n                \"Requires StatisticalCategoryDataset.\");\n        }\n        StatisticalCategoryDataset statData = (StatisticalCategoryDataset) data;\n\n        PlotOrientation orientation = plot.getOrientation();\n        if (orientation == PlotOrientation.HORIZONTAL) {\n            drawHorizontalItem(g2, state, dataArea, plot, domainAxis, \n                    rangeAxis, statData, row, column);\n        }\n        else if (orientation == PlotOrientation.VERTICAL) {\n            drawVerticalItem(g2, state, dataArea, plot, domainAxis, rangeAxis, \n                    statData, row, column);\n        }\n    }", "class": "StatisticalBarRenderer", "signature": "void drawItem(Graphics2D g2,\n                         CategoryItemRendererState state,\n                         Rectangle2D dataArea,\n                         CategoryPlot plot,\n                         CategoryAxis domainAxis,\n                         ValueAxis rangeAxis,\n                         CategoryDataset data,\n                         int row,\n                         int column,\n                         int pass)", "full_signature": "public void drawItem(Graphics2D g2,\n                         CategoryItemRendererState state,\n                         Rectangle2D dataArea,\n                         CategoryPlot plot,\n                         CategoryAxis domainAxis,\n                         ValueAxis rangeAxis,\n                         CategoryDataset data,\n                         int row,\n                         int column,\n                         int pass)", "class_method_signature": "StatisticalBarRenderer.drawItem(Graphics2D g2,\n                         CategoryItemRendererState state,\n                         Rectangle2D dataArea,\n                         CategoryPlot plot,\n                         CategoryAxis domainAxis,\n                         ValueAxis rangeAxis,\n                         CategoryDataset data,\n                         int row,\n                         int column,\n                         int pass)", "testcase": false, "constructor": false, "invocations": ["getOrientation", "drawHorizontalItem", "drawVerticalItem"]}