{"identifier": "clone", "parameters": "()", "modifiers": "public", "return": "Object", "body": "public Object clone() throws CloneNotSupportedException {\n        \n        CategoryPlot clone = (CategoryPlot) super.clone();\n        \n        clone.domainAxes = new ObjectList();\n        for (int i = 0; i < this.domainAxes.size(); i++) {\n            CategoryAxis xAxis = (CategoryAxis) this.domainAxes.get(i);\n            if (xAxis != null) {\n                CategoryAxis clonedAxis = (CategoryAxis) xAxis.clone();\n                clone.setDomainAxis(i, clonedAxis);\n            }\n        }\n        clone.domainAxisLocations \n            = (ObjectList) this.domainAxisLocations.clone();\n\n        clone.rangeAxes = new ObjectList();\n        for (int i = 0; i < this.rangeAxes.size(); i++) {\n            ValueAxis yAxis = (ValueAxis) this.rangeAxes.get(i);\n            if (yAxis != null) {\n                ValueAxis clonedAxis = (ValueAxis) yAxis.clone();\n                clone.setRangeAxis(i, clonedAxis);\n            }\n        }\n        clone.rangeAxisLocations = (ObjectList) this.rangeAxisLocations.clone();\n\n        clone.datasets = (ObjectList) this.datasets.clone();\n        for (int i = 0; i < clone.datasets.size(); i++) {\n            CategoryDataset dataset = clone.getDataset(i);\n            if (dataset != null) {\n                dataset.addChangeListener(clone);\n            }\n        }\n        clone.datasetToDomainAxisMap \n            = (ObjectList) this.datasetToDomainAxisMap.clone();\n        clone.datasetToRangeAxisMap \n            = (ObjectList) this.datasetToRangeAxisMap.clone();\n        clone.renderers = (ObjectList) this.renderers.clone();\n        if (this.fixedDomainAxisSpace != null) {\n            clone.fixedDomainAxisSpace = (AxisSpace) ObjectUtilities.clone(\n                    this.fixedDomainAxisSpace);\n        }\n        if (this.fixedRangeAxisSpace != null) {\n            clone.fixedRangeAxisSpace = (AxisSpace) ObjectUtilities.clone(\n                    this.fixedRangeAxisSpace);\n        }\n        \n        return clone;\n            \n    }", "class": "CategoryPlot", "signature": "Object clone()", "full_signature": "public Object clone()", "class_method_signature": "CategoryPlot.clone()", "testcase": false, "constructor": false, "invocations": ["clone", "size", "get", "clone", "setDomainAxis", "clone", "size", "get", "clone", "setRangeAxis", "clone", "clone", "size", "getDataset", "addChangeListener", "clone", "clone", "clone", "clone", "clone"]}