{"identifier": "setDataset", "parameters": "(CategoryDataset dataset)", "modifiers": "public", "return": "void", "body": "public void setDataset(CategoryDataset dataset) {\n        // if there is an existing dataset, remove the plot from the list of\n        // change listeners...\n        if (this.dataset != null) {\n            this.dataset.removeChangeListener(this);\n        }\n\n        // set the new dataset, and register the chart as a change listener...\n        this.dataset = dataset;\n        if (dataset != null) {\n            setDatasetGroup(dataset.getGroup());\n            dataset.addChangeListener(this);\n        }\n\n        // send a dataset change event to self to trigger plot change event\n        datasetChanged(new DatasetChangeEvent(this, dataset));\n    }", "class": "MultiplePiePlot", "signature": "void setDataset(CategoryDataset dataset)", "full_signature": "public void setDataset(CategoryDataset dataset)", "class_method_signature": "MultiplePiePlot.setDataset(CategoryDataset dataset)", "testcase": false, "constructor": false, "invocations": ["removeChangeListener", "setDatasetGroup", "getGroup", "addChangeListener", "datasetChanged"]}