{"identifier": "drawRangeLine", "parameters": "(Graphics2D g2, CategoryPlot plot, ValueAxis axis,\n            Rectangle2D dataArea, double value, Paint paint, Stroke stroke)", "modifiers": "public", "return": "void", "body": "public void drawRangeLine(Graphics2D g2, CategoryPlot plot, ValueAxis axis,\n            Rectangle2D dataArea, double value, Paint paint, Stroke stroke) {\n\n        Range range = axis.getRange();\n        if (!range.contains(value)) {\n            return;\n        }\n\n        PlotOrientation orientation = plot.getOrientation();\n        Line2D line = null;\n        double v = axis.valueToJava2D(value, dataArea, plot.getRangeAxisEdge());\n        if (orientation == PlotOrientation.HORIZONTAL) {\n            line = new Line2D.Double(v, dataArea.getMinY(), v,\n                    dataArea.getMaxY());\n        }\n        else if (orientation == PlotOrientation.VERTICAL) {\n            line = new Line2D.Double(dataArea.getMinX(), v,\n                    dataArea.getMaxX(), v);\n        }\n\n        g2.setPaint(paint);\n        g2.setStroke(stroke);\n        g2.draw(line);\n\n    }", "class": "AbstractCategoryItemRenderer", "signature": "void drawRangeLine(Graphics2D g2, CategoryPlot plot, ValueAxis axis,\n            Rectangle2D dataArea, double value, Paint paint, Stroke stroke)", "full_signature": "public void drawRangeLine(Graphics2D g2, CategoryPlot plot, ValueAxis axis,\n            Rectangle2D dataArea, double value, Paint paint, Stroke stroke)", "class_method_signature": "AbstractCategoryItemRenderer.drawRangeLine(Graphics2D g2, CategoryPlot plot, ValueAxis axis,\n            Rectangle2D dataArea, double value, Paint paint, Stroke stroke)", "testcase": false, "constructor": false, "invocations": ["getRange", "contains", "getOrientation", "valueToJava2D", "getRangeAxisEdge", "getMinY", "getMaxY", "getMinX", "getMaxX", "setPaint", "setStroke", "draw"]}