{"identifier": "createObject", "parameters": "(String str)", "modifiers": "public static", "return": "Object", "body": "public static Object createObject(String str)\n    {\n        Class cl = null;\n\n        try\n        {\n            cl = Class.forName(str);\n        }\n        catch (ClassNotFoundException cnfe)\n        {\n            System.err.println(\"Unable to find: \" + str);\n\n            return null;\n        }\n\n        Object instance = null;\n\n        try\n        {\n            instance = cl.newInstance();\n        }\n        catch (InstantiationException cnfe)\n        {\n            System.err.println(\"InstantiationException; Unable to create: \"\n                               + str);\n\n            return null;\n        }\n        catch (IllegalAccessException cnfe)\n        {\n            System.err.println(\"IllegalAccessException; Unable to create: \"\n                               + str);\n\n            return null;\n        }\n\n        return instance;\n    }", "class": "TypeHandler", "signature": "Object createObject(String str)", "full_signature": "public static Object createObject(String str)", "class_method_signature": "TypeHandler.createObject(String str)", "testcase": false, "constructor": false, "invocations": ["forName", "println", "newInstance", "println", "println"]}