{"identifier": "addOrUpdate", "parameters": "(Number x, Number y)", "modifiers": "public", "return": "XYDataItem", "body": "public XYDataItem addOrUpdate(Number x, Number y) {\n        if (x == null) {\n            throw new IllegalArgumentException(\"Null 'x' argument.\");\n        }\n        if (this.allowDuplicateXValues) {\n            add(x, y);\n            return null;\n        }\n\n        // if we get to here, we know that duplicate X values are not permitted\n        XYDataItem overwritten = null;\n        int index = indexOf(x);\n        if (index >= 0) {\n            XYDataItem existing = (XYDataItem) this.data.get(index);\n            try {\n                overwritten = (XYDataItem) existing.clone();\n            }\n            catch (CloneNotSupportedException e) {\n                throw new SeriesException(\"Couldn't clone XYDataItem!\");\n            }\n            existing.setY(y);\n        }\n        else {\n            // if the series is sorted, the negative index is a result from\n            // Collections.binarySearch() and tells us where to insert the\n            // new item...otherwise it will be just -1 and we should just\n            // append the value to the list...\n            if (this.autoSort) {\n                this.data.add(-index - 1, new XYDataItem(x, y));\n            }\n            else {\n                this.data.add(new XYDataItem(x, y));\n            }\n            // check if this addition will exceed the maximum item count...\n            if (getItemCount() > this.maximumItemCount) {\n                this.data.remove(0);\n            }\n        }\n        fireSeriesChanged();\n        return overwritten;\n    }", "class": "XYSeries", "signature": "XYDataItem addOrUpdate(Number x, Number y)", "full_signature": "public XYDataItem addOrUpdate(Number x, Number y)", "class_method_signature": "XYSeries.addOrUpdate(Number x, Number y)", "testcase": false, "constructor": false, "invocations": ["add", "indexOf", "get", "clone", "setY", "add", "add", "getItemCount", "remove", "fireSeriesChanged"]}