{"identifier": "findRangeBounds", "parameters": "(CategoryDataset dataset,\n            List visibleSeriesKeys, boolean includeInterval)", "modifiers": "public static", "return": "Range", "body": "public static Range findRangeBounds(CategoryDataset dataset,\n            List visibleSeriesKeys, boolean includeInterval) {\n        if (dataset == null) {\n            throw new IllegalArgumentException(\"Null 'dataset' argument.\");\n        }\n        Range result = null;\n        if (dataset instanceof CategoryRangeInfo) {\n            CategoryRangeInfo info = (CategoryRangeInfo) dataset;\n            result = info.getRangeBounds(visibleSeriesKeys, includeInterval);\n        }\n        else {\n            result = iterateToFindRangeBounds(dataset, visibleSeriesKeys,\n                    includeInterval);\n        }\n        return result;\n    }", "class": "DatasetUtilities", "signature": "Range findRangeBounds(CategoryDataset dataset,\n            List visibleSeriesKeys, boolean includeInterval)", "full_signature": "public static Range findRangeBounds(CategoryDataset dataset,\n            List visibleSeriesKeys, boolean includeInterval)", "class_method_signature": "DatasetUtilities.findRangeBounds(CategoryDataset dataset,\n            List visibleSeriesKeys, boolean includeInterval)", "testcase": false, "constructor": false, "invocations": ["getRangeBounds", "iterateToFindRangeBounds"]}