{"identifier": "setCategoryKeys", "parameters": "(Comparable[] categoryKeys)", "modifiers": "public", "return": "void", "body": "public void setCategoryKeys(Comparable[] categoryKeys) {\n        if (categoryKeys == null) {\n            throw new IllegalArgumentException(\"Null 'categoryKeys' argument.\");\n        }\n        if (categoryKeys.length != getCategoryCount()) {\n            throw new IllegalArgumentException(\n                    \"The number of categories does not match the data.\");\n        }\n        for (int i = 0; i < categoryKeys.length; i++) {\n            if (categoryKeys[i] == null) {\n                throw new IllegalArgumentException(\n                    \"DefaultIntervalCategoryDataset.setCategoryKeys(): \"\n                    + \"null category not permitted.\");\n            }\n        }\n        this.categoryKeys = categoryKeys;\n        fireDatasetChanged();\n    }", "class": "DefaultIntervalCategoryDataset", "signature": "void setCategoryKeys(Comparable[] categoryKeys)", "full_signature": "public void setCategoryKeys(Comparable[] categoryKeys)", "class_method_signature": "DefaultIntervalCategoryDataset.setCategoryKeys(Comparable[] categoryKeys)", "testcase": false, "constructor": false, "invocations": ["getCategoryCount", "fireDatasetChanged"]}