{"identifier": "setDataset", "parameters": "(PieDataset dataset)", "modifiers": "public", "return": "void", "body": "public void setDataset(PieDataset dataset) {\n        // if there is an existing dataset, remove the plot from the list of \n        // change listeners...\n        PieDataset existing = this.dataset;\n        if (existing != null) {\n            existing.removeChangeListener(this);\n        }\n\n        // set the new dataset, and register the chart as a change listener...\n        this.dataset = dataset;\n        if (dataset != null) {\n            setDatasetGroup(dataset.getGroup());\n            dataset.addChangeListener(this);\n        }\n\n        // send a dataset change event to self...\n        DatasetChangeEvent event = new DatasetChangeEvent(this, dataset);\n        datasetChanged(event);\n    }", "class": "PiePlot", "signature": "void setDataset(PieDataset dataset)", "full_signature": "public void setDataset(PieDataset dataset)", "class_method_signature": "PiePlot.setDataset(PieDataset dataset)", "testcase": false, "constructor": false, "invocations": ["removeChangeListener", "setDatasetGroup", "getGroup", "addChangeListener", "datasetChanged"]}