{"identifier": "removeColumn", "parameters": "(Comparable columnKey)", "modifiers": "public", "return": "void", "body": "public void removeColumn(Comparable columnKey) {\n    \tif (columnKey == null) {\n    \t\tthrow new IllegalArgumentException(\"Null 'columnKey' argument.\");\n    \t}\n    \tif (!this.columnKeys.contains(columnKey)) {\n    \t\tthrow new UnknownKeyException(\"Unknown key: \" + columnKey);\n    \t}\n        Iterator iterator = this.rows.iterator();\n        while (iterator.hasNext()) {\n            DefaultKeyedValues rowData = (DefaultKeyedValues) iterator.next();\n            int index = rowData.getIndex(columnKey);\n            if (index >= 0) {\n                rowData.removeValue(columnKey);\n            }\n        }\n        this.columnKeys.remove(columnKey);\n    }", "class": "DefaultKeyedValues2D", "signature": "void removeColumn(Comparable columnKey)", "full_signature": "public void removeColumn(Comparable columnKey)", "class_method_signature": "DefaultKeyedValues2D.removeColumn(Comparable columnKey)", "testcase": false, "constructor": false, "invocations": ["contains", "iterator", "hasNext", "next", "getIndex", "removeValue", "remove"]}