{"identifier": "clearRangeMarkers", "parameters": "(int index)", "modifiers": "public", "return": "void", "body": "public void clearRangeMarkers(int index) {\n        Integer key = new Integer(index);\n        if (this.backgroundRangeMarkers != null) {\n            Collection markers \n                = (Collection) this.backgroundRangeMarkers.get(key);\n            if (markers != null) {\n                Iterator iterator = markers.iterator();\n                while (iterator.hasNext()) {\n                    Marker m = (Marker) iterator.next();\n                    m.removeChangeListener(this);\n                }\n                markers.clear();\n            }\n        }\n        if (this.foregroundRangeMarkers != null) {\n            Collection markers \n                = (Collection) this.foregroundRangeMarkers.get(key);\n            if (markers != null) {\n                Iterator iterator = markers.iterator();\n                while (iterator.hasNext()) {\n                    Marker m = (Marker) iterator.next();\n                    m.removeChangeListener(this);\n                }\n                markers.clear();\n            }\n        }\n        fireChangeEvent();\n    }", "class": "CategoryPlot", "signature": "void clearRangeMarkers(int index)", "full_signature": "public void clearRangeMarkers(int index)", "class_method_signature": "CategoryPlot.clearRangeMarkers(int index)", "testcase": false, "constructor": false, "invocations": ["get", "iterator", "hasNext", "next", "removeChangeListener", "clear", "get", "iterator", "hasNext", "next", "removeChangeListener", "clear", "fireChangeEvent"]}