{"identifier": "draw", "parameters": "(Graphics2D g2, Rectangle2D area, Point2D anchor,\n                     PlotState parentState, PlotRenderingInfo info)", "modifiers": "public", "return": "void", "body": "public void draw(Graphics2D g2, Rectangle2D area, Point2D anchor,\n                     PlotState parentState, PlotRenderingInfo info) {\n\n        // adjust for insets...\n        RectangleInsets insets = getInsets();\n        insets.trim(area);\n\n        if (info != null) {\n            info.setPlotArea(area);\n            info.setDataArea(area);\n        }\n\n        drawBackground(g2, area);\n        drawOutline(g2, area);\n\n        Shape savedClip = g2.getClip();\n        g2.clip(area);\n\n        Composite originalComposite = g2.getComposite();\n        g2.setComposite(AlphaComposite.getInstance(AlphaComposite.SRC_OVER, \n                getForegroundAlpha()));\n\n        if (!DatasetUtilities.isEmptyOrNull(this.dataset)) {\n            drawPie(g2, area, info);\n        }\n        else {\n            drawNoDataMessage(g2, area);\n        }\n\n        g2.setClip(savedClip);\n        g2.setComposite(originalComposite);\n\n        drawOutline(g2, area);\n\n    }", "class": "PiePlot", "signature": "void draw(Graphics2D g2, Rectangle2D area, Point2D anchor,\n                     PlotState parentState, PlotRenderingInfo info)", "full_signature": "public void draw(Graphics2D g2, Rectangle2D area, Point2D anchor,\n                     PlotState parentState, PlotRenderingInfo info)", "class_method_signature": "PiePlot.draw(Graphics2D g2, Rectangle2D area, Point2D anchor,\n                     PlotState parentState, PlotRenderingInfo info)", "testcase": false, "constructor": false, "invocations": ["getInsets", "trim", "setPlotArea", "setDataArea", "drawBackground", "drawOutline", "getClip", "clip", "getComposite", "setComposite", "getInstance", "getForegroundAlpha", "isEmptyOrNull", "drawPie", "drawNoDataMessage", "setClip", "setComposite", "drawOutline"]}