{"identifier": "clearSelection", "parameters": "()", "modifiers": "public", "return": "void", "body": "public void clearSelection() {\n        // cycle through the datasets and clear the selection state\n        int datasetCount = this.datasets.size();\n        for (int d = 0; d < datasetCount; d++) {\n            XYDataset dataset = (XYDataset) this.datasets.get(d);\n            if (dataset instanceof AbstractXYDataset) {\n                // TODO: we could add an interface that *any* dataset could\n                // implement if it provides a selection state\n                AbstractXYDataset axyd = (AbstractXYDataset) dataset;\n                if (axyd.getSelectionState() != null) {\n                    XYDatasetSelectionState selState = axyd.getSelectionState();\n                    selState.clearSelection();\n                }\n            }\n        }\n    }", "class": "XYPlot", "signature": "void clearSelection()", "full_signature": "public void clearSelection()", "class_method_signature": "XYPlot.clearSelection()", "testcase": false, "constructor": false, "invocations": ["size", "get", "getSelectionState", "getSelectionState", "clearSelection"]}