{"identifier": "findDomainBounds", "parameters": "(XYDataset dataset,\n                                         boolean includeInterval)", "modifiers": "public static", "return": "Range", "body": "public static Range findDomainBounds(XYDataset dataset,\n                                         boolean includeInterval) {\n\n        if (dataset == null) {\n            throw new IllegalArgumentException(\"Null 'dataset' argument.\");\n        }\n\n        Range result = null;\n        // if the dataset implements DomainInfo, life is easier\n        if (dataset instanceof DomainInfo) {\n            DomainInfo info = (DomainInfo) dataset;\n            result = info.getDomainBounds(includeInterval);\n        }\n        else {\n            result = iterateDomainBounds(dataset, includeInterval);\n        }\n        return result;\n\n    }", "class": "DatasetUtilities", "signature": "Range findDomainBounds(XYDataset dataset,\n                                         boolean includeInterval)", "full_signature": "public static Range findDomainBounds(XYDataset dataset,\n                                         boolean includeInterval)", "class_method_signature": "DatasetUtilities.findDomainBounds(XYDataset dataset,\n                                         boolean includeInterval)", "testcase": false, "constructor": false, "invocations": ["getDomainBounds", "iterateDomainBounds"]}