{"identifier": "equals", "parameters": "(Object obj)", "modifiers": "public", "return": "boolean", "body": "public boolean equals(Object obj) {\n        if (obj == this) {\n            return true;\n        }\n        if (!(obj instanceof Axis)) {\n            return false;\n        }\n        Axis that = (Axis) obj;\n        if (this.visible != that.visible) {\n            return false;\n        }\n        if (!ObjectUtilities.equal(this.label, that.label)) {\n            return false;\n        }\n        if (!ObjectUtilities.equal(this.labelFont, that.labelFont)) {\n            return false;\n        }\n        if (!PaintUtilities.equal(this.labelPaint, that.labelPaint)) {\n            return false;\n        }\n        if (!ObjectUtilities.equal(this.labelInsets, that.labelInsets)) {\n            return false;\n        }\n        if (this.labelAngle != that.labelAngle) {\n            return false;\n        }\n        if (!ObjectUtilities.equal(this.labelToolTip, that.labelToolTip)) {\n            return false;\n        }\n        if (!ObjectUtilities.equal(this.labelURL, that.labelURL)) {\n            return false;\n        }\n        if (this.axisLineVisible != that.axisLineVisible) {\n            return false;\n        }\n        if (!ObjectUtilities.equal(this.axisLineStroke, that.axisLineStroke)) {\n            return false;\n        }\n        if (!PaintUtilities.equal(this.axisLinePaint, that.axisLinePaint)) {\n            return false;\n        }\n        if (this.tickLabelsVisible != that.tickLabelsVisible) {\n            return false;\n        }\n        if (!ObjectUtilities.equal(this.tickLabelFont, that.tickLabelFont)) {\n            return false;\n        }\n        if (!PaintUtilities.equal(this.tickLabelPaint, that.tickLabelPaint)) {\n            return false;\n        }\n        if (!ObjectUtilities.equal(\n            this.tickLabelInsets, that.tickLabelInsets\n        )) {\n            return false;\n        }\n        if (this.tickMarksVisible != that.tickMarksVisible) {\n            return false;\n        }\n        if (this.tickMarkInsideLength != that.tickMarkInsideLength) {\n            return false;\n        }                  \n        if (this.tickMarkOutsideLength != that.tickMarkOutsideLength) {\n            return false;\n        }                  \n        if (!PaintUtilities.equal(this.tickMarkPaint, that.tickMarkPaint)) {\n            return false;\n        }\n        if (!ObjectUtilities.equal(this.tickMarkStroke, that.tickMarkStroke)) {\n            return false;\n        }\n        if (this.fixedDimension != that.fixedDimension) {\n            return false;\n        }\n        return true;\n    }", "class": "Axis", "signature": "boolean equals(Object obj)", "full_signature": "public boolean equals(Object obj)", "class_method_signature": "Axis.equals(Object obj)", "testcase": false, "constructor": false, "invocations": ["equal", "equal", "equal", "equal", "equal", "equal", "equal", "equal", "equal", "equal", "equal", "equal", "equal"]}