{"identifier": "stripAccents", "parameters": "(String input)", "modifiers": "public static", "return": "String", "body": "public static String stripAccents(String input) {\n        if(input == null) {\n            return null;\n        }\n        if(SystemUtils.isJavaVersionAtLeast(1.6f)) {\n\n            // String decomposed = Normalizer.normalize(input, Normalizer.Form.NFD);\n\n            // START of 1.5 reflection - in 1.6 use the line commented out above\n            try {\n                // get java.text.Normalizer.Form class\n                Class<?> normalizerFormClass = ClassUtils.getClass(\"java.text.Normalizer$Form\", false);\n\n                // get Normlizer class\n                Class<?> normalizerClass = ClassUtils.getClass(\"java.text.Normalizer\", false);\n\n                // get static method on Normalizer\n                java.lang.reflect.Method method = normalizerClass.getMethod(\"normalize\", CharSequence.class, normalizerFormClass );\n\n                // get Normalizer.NFD field\n                java.lang.reflect.Field nfd = normalizerFormClass.getField(\"NFD\");\n\n                // invoke method\n                String decomposed = (String) method.invoke( null, input, nfd.get(null) );\n                // END of 1.5 reflection\n\n                java.util.regex.Pattern accentPattern = java.util.regex.Pattern.compile(\"\\\\p{InCombiningDiacriticalMarks}+\");\n                return accentPattern.matcher(decomposed).replaceAll(\"\");\n            } catch(ClassNotFoundException cnfe) {\n                throw new RuntimeException(\"ClassNotFoundException occurred during 1.6 backcompat code\", cnfe);\n            } catch(NoSuchMethodException nsme) {\n                throw new RuntimeException(\"NoSuchMethodException occurred during 1.6 backcompat code\", nsme);\n            } catch(NoSuchFieldException nsfe) {\n                throw new RuntimeException(\"NoSuchFieldException occurred during 1.6 backcompat code\", nsfe);\n            } catch(IllegalAccessException iae) {\n                throw new RuntimeException(\"IllegalAccessException occurred during 1.6 backcompat code\", iae);\n            } catch(IllegalArgumentException iae) {\n                throw new RuntimeException(\"IllegalArgumentException occurred during 1.6 backcompat code\", iae);\n            } catch(java.lang.reflect.InvocationTargetException ite) {\n                throw new RuntimeException(\"InvocationTargetException occurred during 1.6 backcompat code\", ite);\n            } catch(SecurityException se) {\n                throw new RuntimeException(\"SecurityException occurred during 1.6 backcompat code\", se);\n            }\n        } else {\n            throw new UnsupportedOperationException(\"The stripAccents(String) method is not supported until Java 1.6\");\n        }\n    }", "class": "StringUtils", "signature": "String stripAccents(String input)", "full_signature": "public static String stripAccents(String input)", "class_method_signature": "StringUtils.stripAccents(String input)", "testcase": false, "constructor": false, "invocations": ["isJavaVersionAtLeast", "getClass", "getClass", "getMethod", "getField", "invoke", "get", "compile", "replaceAll", "matcher"]}