{"identifier": "handleClick", "parameters": "(int x, int y, PlotRenderingInfo info)", "modifiers": "public", "return": "void", "body": "public void handleClick(int x, int y, PlotRenderingInfo info) {\n\n        Rectangle2D dataArea = info.getDataArea();\n        if (dataArea.contains(x, y)) {\n            // set the anchor value for the horizontal axis...\n            ValueAxis xaxis = getDomainAxis();\n            if (xaxis != null) {\n                double hvalue = xaxis.java2DToValue(x, info.getDataArea(),\n                        getDomainAxisEdge());\n                setDomainCrosshairValue(hvalue);\n            }\n\n            // set the anchor value for the vertical axis...\n            ValueAxis yaxis = getRangeAxis();\n            if (yaxis != null) {\n                double vvalue = yaxis.java2DToValue(y, info.getDataArea(),\n                        getRangeAxisEdge());\n                setRangeCrosshairValue(vvalue);\n            }\n        }\n    }", "class": "XYPlot", "signature": "void handleClick(int x, int y, PlotRenderingInfo info)", "full_signature": "public void handleClick(int x, int y, PlotRenderingInfo info)", "class_method_signature": "XYPlot.handleClick(int x, int y, PlotRenderingInfo info)", "testcase": false, "constructor": false, "invocations": ["getDataArea", "contains", "getDomainAxis", "java2DToValue", "getDataArea", "getDomainAxisEdge", "setDomainCrosshairValue", "getRangeAxis", "java2DToValue", "getDataArea", "getRangeAxisEdge", "setRangeCrosshairValue"]}