{"identifier": "removeDomainMarker", "parameters": "(int index, Marker marker, Layer layer,\n    \t\tboolean notify)", "modifiers": "public", "return": "boolean", "body": "public boolean removeDomainMarker(int index, Marker marker, Layer layer,\n    \t\tboolean notify) {\n        ArrayList markers;\n        if (layer == Layer.FOREGROUND) {\n            markers = (ArrayList) this.foregroundDomainMarkers.get(new Integer(\n                    index));\n        }\n        else {\n            markers = (ArrayList) this.backgroundDomainMarkers.get(new Integer(\n                    index));\n        }\n        if (markers == null) {\n            return false;\n        }\n        boolean removed = markers.remove(marker);\n        if (removed && notify) {\n            fireChangeEvent();\n        }\n        return removed;\n    }", "class": "CategoryPlot", "signature": "boolean removeDomainMarker(int index, Marker marker, Layer layer,\n    \t\tboolean notify)", "full_signature": "public boolean removeDomainMarker(int index, Marker marker, Layer layer,\n    \t\tboolean notify)", "class_method_signature": "CategoryPlot.removeDomainMarker(int index, Marker marker, Layer layer,\n    \t\tboolean notify)", "testcase": false, "constructor": false, "invocations": ["get", "get", "remove", "fireChangeEvent"]}