{"identifier": "print", "parameters": "(final Object value, final Appendable out, final boolean newRecord)", "modifiers": "public", "return": "void", "body": "public void print(final Object value, final Appendable out, final boolean newRecord) throws IOException {\n        // null values are considered empty\n        // Only call CharSequence.toString() if you have to, helps GC-free use cases.\n        CharSequence charSequence;\n        if (value == null) {\n            charSequence = nullString == null ? Constants.EMPTY : nullString;\n        } else {\n            charSequence = value instanceof CharSequence ? (CharSequence) value : value.toString();\n        }\n        charSequence = getTrim() ? trim(charSequence) : charSequence;\n        this.print(value, charSequence, 0, charSequence.length(), out, newRecord);\n    }", "class": "CSVFormat", "signature": "void print(final Object value, final Appendable out, final boolean newRecord)", "full_signature": "public void print(final Object value, final Appendable out, final boolean newRecord)", "class_method_signature": "CSVFormat.print(final Object value, final Appendable out, final boolean newRecord)", "testcase": false, "constructor": false, "invocations": ["toString", "getTrim", "trim", "print", "length"]}