{"identifier": "printHelp", "parameters": "(PrintWriter pw, int width, String cmdLineSyntax,\n                          String header, Options options, int leftPad,\n                          int descPad, String footer, boolean autoUsage)", "modifiers": "public", "return": "void", "body": "public void printHelp(PrintWriter pw, int width, String cmdLineSyntax,\n                          String header, Options options, int leftPad,\n                          int descPad, String footer, boolean autoUsage)\n    {\n        if ((cmdLineSyntax == null) || (cmdLineSyntax.length() == 0))\n        {\n            throw new IllegalArgumentException(\"cmdLineSyntax not provided\");\n        }\n\n        if (autoUsage)\n        {\n            printUsage(pw, width, cmdLineSyntax, options);\n        }\n        else\n        {\n            printUsage(pw, width, cmdLineSyntax);\n        }\n\n        if ((header != null) && (header.trim().length() > 0))\n        {\n            printWrapped(pw, width, header);\n        }\n\n        printOptions(pw, width, options, leftPad, descPad);\n\n        if ((footer != null) && (footer.trim().length() > 0))\n        {\n            printWrapped(pw, width, footer);\n        }\n    }", "class": "HelpFormatter", "signature": "void printHelp(PrintWriter pw, int width, String cmdLineSyntax,\n                          String header, Options options, int leftPad,\n                          int descPad, String footer, boolean autoUsage)", "full_signature": "public void printHelp(PrintWriter pw, int width, String cmdLineSyntax,\n                          String header, Options options, int leftPad,\n                          int descPad, String footer, boolean autoUsage)", "class_method_signature": "HelpFormatter.printHelp(PrintWriter pw, int width, String cmdLineSyntax,\n                          String header, Options options, int leftPad,\n                          int descPad, String footer, boolean autoUsage)", "testcase": false, "constructor": false, "invocations": ["length", "printUsage", "printUsage", "length", "trim", "printWrapped", "printOptions", "length", "trim", "printWrapped"]}