{"identifier": "toLocale", "parameters": "(final String str)", "modifiers": "public static", "return": "Locale", "body": "public static Locale toLocale(final String str) {\n        if (str == null) {\n            return null;\n        }\n        final int len = str.length();\n        if (len < 2) {\n            throw new IllegalArgumentException(\"Invalid locale format: \" + str);\n        }\n        final char ch0 = str.charAt(0);\n        if (ch0 == '_') {\n            if (len < 3) {\n                throw new IllegalArgumentException(\"Invalid locale format: \" + str);\n            }\n            final char ch1 = str.charAt(1);\n            final char ch2 = str.charAt(2);\n            if (!Character.isUpperCase(ch1) || !Character.isUpperCase(ch2)) {\n                throw new IllegalArgumentException(\"Invalid locale format: \" + str);\n            }\n            if (len == 3) {\n                return new Locale(\"\", str.substring(1, 3));\n            }\n            if (len < 5) {\n                throw new IllegalArgumentException(\"Invalid locale format: \" + str);\n            }\n            if (str.charAt(3) != '_') {\n                throw new IllegalArgumentException(\"Invalid locale format: \" + str);\n            }\n            return new Locale(\"\", str.substring(1, 3), str.substring(4));\n        } else {\n            final char ch1 = str.charAt(1);\n            if (!Character.isLowerCase(ch0) || !Character.isLowerCase(ch1)) {\n                throw new IllegalArgumentException(\"Invalid locale format: \" + str);\n            }\n            if (len == 2) {\n                return new Locale(str);\n            }\n            if (len < 5) {\n                throw new IllegalArgumentException(\"Invalid locale format: \" + str);\n            }\n            if (str.charAt(2) != '_') {\n                throw new IllegalArgumentException(\"Invalid locale format: \" + str);\n            }\n            final char ch3 = str.charAt(3);\n            if (ch3 == '_') {\n                return new Locale(str.substring(0, 2), \"\", str.substring(4));\n            }\n            final char ch4 = str.charAt(4);\n            if (!Character.isUpperCase(ch3) || !Character.isUpperCase(ch4)) {\n                throw new IllegalArgumentException(\"Invalid locale format: \" + str);\n            }\n            if (len == 5) {\n                return new Locale(str.substring(0, 2), str.substring(3, 5));\n            }\n            if (len < 7) {\n                throw new IllegalArgumentException(\"Invalid locale format: \" + str);\n            }\n            if (str.charAt(5) != '_') {\n                throw new IllegalArgumentException(\"Invalid locale format: \" + str);\n            }\n            return new Locale(str.substring(0, 2), str.substring(3, 5), str.substring(6));\n        }\n    }", "class": "LocaleUtils", "signature": "Locale toLocale(final String str)", "full_signature": "public static Locale toLocale(final String str)", "class_method_signature": "LocaleUtils.toLocale(final String str)", "testcase": false, "constructor": false, "invocations": ["length", "charAt", "charAt", "charAt", "isUpperCase", "isUpperCase", "substring", "charAt", "substring", "substring", "charAt", "isLowerCase", "isLowerCase", "charAt", "charAt", "substring", "substring", "charAt", "isUpperCase", "isUpperCase", "substring", "substring", "charAt", "substring", "substring", "substring"]}