{"identifier": "withHeader", "parameters": "(final ResultSetMetaData metaData)", "modifiers": "public", "return": "CSVFormat", "body": "public CSVFormat withHeader(final ResultSetMetaData metaData) throws SQLException {\n        String[] labels = null;\n        if (metaData != null) {\n            final int columnCount = metaData.getColumnCount();\n            labels = new String[columnCount];\n            for (int i = 0; i < columnCount; i++) {\n                labels[i] = metaData.getColumnLabel(i + 1);\n            }\n        }\n        return new CSVFormat(delimiter, quoteCharacter, quoteMode, commentMarker, escapeCharacter,\n                ignoreSurroundingSpaces, ignoreEmptyLines, recordSeparator, nullString, headerComments, labels,\n                skipHeaderRecord, allowMissingColumnNames, ignoreHeaderCase);\n    }", "class": "CSVFormat", "signature": "CSVFormat withHeader(final ResultSetMetaData metaData)", "full_signature": "public CSVFormat withHeader(final ResultSetMetaData metaData)", "class_method_signature": "CSVFormat.withHeader(final ResultSetMetaData metaData)", "testcase": false, "constructor": false, "invocations": ["getColumnCount", "getColumnLabel"]}