{"identifier": "handleClick", "parameters": "(int x, int y, PlotRenderingInfo info)", "modifiers": "public", "return": "void", "body": "public void handleClick(int x, int y, PlotRenderingInfo info) {\n\n        Rectangle2D dataArea = info.getDataArea();\n        if (dataArea.contains(x, y)) {\n            // set the anchor value for the range axis...\n            double java2D = 0.0;\n            if (this.orientation == PlotOrientation.HORIZONTAL) {\n                java2D = x;\n            }\n            else if (this.orientation == PlotOrientation.VERTICAL) {\n                java2D = y;\n            }\n            RectangleEdge edge = Plot.resolveRangeAxisLocation(\n                    getRangeAxisLocation(), this.orientation);\n            double value = getRangeAxis().java2DToValue(\n                    java2D, info.getDataArea(), edge);\n            setAnchorValue(value);\n            setRangeCrosshairValue(value);\n        }\n\n    }", "class": "CategoryPlot", "signature": "void handleClick(int x, int y, PlotRenderingInfo info)", "full_signature": "public void handleClick(int x, int y, PlotRenderingInfo info)", "class_method_signature": "CategoryPlot.handleClick(int x, int y, PlotRenderingInfo info)", "testcase": false, "constructor": false, "invocations": ["getDataArea", "contains", "resolveRangeAxisLocation", "getRangeAxisLocation", "java2DToValue", "getRangeAxis", "getDataArea", "setAnchorValue", "setRangeCrosshairValue"]}