{"identifier": "equals", "parameters": "(Object obj)", "modifiers": "public", "return": "boolean", "body": "public boolean equals(Object obj) {\n        if (obj == this) {\n            return true;\n        }\n        if (!(obj instanceof BorderArrangement)) {\n            return false;\n        }\n        BorderArrangement that = (BorderArrangement) obj;\n        if (!ObjectUtilities.equal(this.topBlock, that.topBlock)) {\n            return false;\n        }\n        if (!ObjectUtilities.equal(this.bottomBlock, that.bottomBlock)) {\n            return false;\n        }\n        if (!ObjectUtilities.equal(this.leftBlock, that.leftBlock)) {\n            return false;\n        }\n        if (!ObjectUtilities.equal(this.rightBlock, that.rightBlock)) {\n            return false;\n        }\n        if (!ObjectUtilities.equal(this.centerBlock, that.centerBlock)) {\n            return false;\n        }\n        return true;\n    }", "class": "BorderArrangement", "signature": "boolean equals(Object obj)", "full_signature": "public boolean equals(Object obj)", "class_method_signature": "BorderArrangement.equals(Object obj)", "testcase": false, "constructor": false, "invocations": ["equal", "equal", "equal", "equal", "equal"]}