{"identifier": "equals", "parameters": "(Object obj)", "modifiers": "public", "return": "boolean", "body": "public boolean equals(Object obj) {\n        if (obj == this) {\n            return true;\n        }\n        if (!(obj instanceof DefaultIntervalCategoryDataset)) {\n            return false;\n        }\n        DefaultIntervalCategoryDataset that \n                = (DefaultIntervalCategoryDataset) obj;\n        if (!Arrays.equals(this.seriesKeys, that.seriesKeys)) {\n            return false;\n        }\n        if (!Arrays.equals(this.categoryKeys, that.categoryKeys)) {\n            return false;\n        }\n        if (!equal(this.startData, that.startData)) {\n            return false;\n        }\n        if (!equal(this.endData, that.endData)) {\n            return false;\n        }\n        // seem to be the same...\n        return true;\n    }", "class": "DefaultIntervalCategoryDataset", "signature": "boolean equals(Object obj)", "full_signature": "public boolean equals(Object obj)", "class_method_signature": "DefaultIntervalCategoryDataset.equals(Object obj)", "testcase": false, "constructor": false, "invocations": ["equals", "equals", "equal", "equal"]}