{"identifier": "zoomRangeAxes", "parameters": "(double factor, PlotRenderingInfo info,\n                              Point2D source, boolean useAnchor)", "modifiers": "public", "return": "void", "body": "public void zoomRangeAxes(double factor, PlotRenderingInfo info,\n                              Point2D source, boolean useAnchor) {\n                \n        // perform the zoom on each range axis\n        for (int i = 0; i < this.rangeAxes.size(); i++) {\n            ValueAxis rangeAxis = (ValueAxis) this.rangeAxes.get(i);\n            if (rangeAxis != null) {\n                if (useAnchor) {\n                    // get the relevant source coordinate given the plot \n                    // orientation\n                    double sourceY = source.getY();\n                    if (this.orientation == PlotOrientation.HORIZONTAL) {\n                        sourceY = source.getX();\n                    }\n                    double anchorY = rangeAxis.java2DToValue(sourceY, \n                            info.getDataArea(), getRangeAxisEdge());\n                    rangeAxis.resizeRange(factor, anchorY);\n                }\n                else {\n                    rangeAxis.resizeRange(factor);\n                }\n            }\n        }\n    }", "class": "XYPlot", "signature": "void zoomRangeAxes(double factor, PlotRenderingInfo info,\n                              Point2D source, boolean useAnchor)", "full_signature": "public void zoomRangeAxes(double factor, PlotRenderingInfo info,\n                              Point2D source, boolean useAnchor)", "class_method_signature": "XYPlot.zoomRangeAxes(double factor, PlotRenderingInfo info,\n                              Point2D source, boolean useAnchor)", "testcase": false, "constructor": false, "invocations": ["size", "get", "getY", "getX", "java2DToValue", "getDataArea", "getRangeAxisEdge", "resizeRange", "resizeRange"]}