{"identifier": "drawRangeTickBands", "parameters": "(Graphics2D g2, Rectangle2D dataArea,\n                                   List ticks)", "modifiers": "public", "return": "void", "body": "public void drawRangeTickBands(Graphics2D g2, Rectangle2D dataArea,\n                                   List ticks) {\n        Paint bandPaint = getRangeTickBandPaint();\n        if (bandPaint != null) {\n            boolean fillBand = false;\n            ValueAxis axis = getRangeAxis();\n            double previous = axis.getLowerBound();\n            Iterator iterator = ticks.iterator();\n            while (iterator.hasNext()) {\n                ValueTick tick = (ValueTick) iterator.next();\n                double current = tick.getValue();\n                if (fillBand) {\n                    getRenderer().fillRangeGridBand(g2, this, axis, dataArea,\n                            previous, current);\n                }\n                previous = current;\n                fillBand = !fillBand;\n            }\n            double end = axis.getUpperBound();\n            if (fillBand) {\n                getRenderer().fillRangeGridBand(g2, this, axis, dataArea,\n                        previous, end);\n            }\n        }\n    }", "class": "XYPlot", "signature": "void drawRangeTickBands(Graphics2D g2, Rectangle2D dataArea,\n                                   List ticks)", "full_signature": "public void drawRangeTickBands(Graphics2D g2, Rectangle2D dataArea,\n                                   List ticks)", "class_method_signature": "XYPlot.drawRangeTickBands(Graphics2D g2, Rectangle2D dataArea,\n                                   List ticks)", "testcase": false, "constructor": false, "invocations": ["getRangeTickBandPaint", "getRangeAxis", "getLowerBound", "iterator", "hasNext", "next", "getValue", "fillRangeGridBand", "getRenderer", "getUpperBound", "fillRangeGridBand", "getRenderer"]}