{"identifier": "equals", "parameters": "(Object obj)", "modifiers": "public", "return": "boolean", "body": "public boolean equals(Object obj) {\n    \n        if (obj == this) {\n            return true;\n        }\n        if (!(obj instanceof CategoryPlot)) {\n            return false;\n        }\n        if (!super.equals(obj)) {\n            return false;\n        }\n\n        CategoryPlot that = (CategoryPlot) obj;\n            \n        if (this.orientation != that.orientation) {\n            return false;\n        }\n        if (!ObjectUtilities.equal(this.axisOffset, that.axisOffset)) {\n            return false;\n        }\n        if (!this.domainAxes.equals(that.domainAxes)) {\n            return false;\n        }\n        if (!this.domainAxisLocations.equals(that.domainAxisLocations)) {\n            return false;\n        }\n        if (this.drawSharedDomainAxis != that.drawSharedDomainAxis) {\n            return false;\n        }\n        if (!this.rangeAxes.equals(that.rangeAxes)) {\n            return false;\n        }\n        if (!this.rangeAxisLocations.equals(that.rangeAxisLocations)) {\n            return false;\n        }\n        if (!ObjectUtilities.equal(this.datasetToDomainAxisMap, \n                that.datasetToDomainAxisMap)) {\n            return false;\n        }\n        if (!ObjectUtilities.equal(this.datasetToRangeAxisMap, \n                that.datasetToRangeAxisMap)) {\n            return false;\n        }\n        if (!ObjectUtilities.equal(this.renderers, that.renderers)) {\n            return false;\n        }\n        if (this.renderingOrder != that.renderingOrder) {\n            return false;\n        }\n        if (this.columnRenderingOrder != that.columnRenderingOrder) {\n            return false;\n        }\n        if (this.rowRenderingOrder != that.rowRenderingOrder) {\n            return false;\n        }\n        if (this.domainGridlinesVisible != that.domainGridlinesVisible) {\n            return false;\n        }\n        if (this.domainGridlinePosition != that.domainGridlinePosition) {\n            return false;\n        }\n        if (!ObjectUtilities.equal(this.domainGridlineStroke, \n                that.domainGridlineStroke)) {\n            return false;\n        }\n        if (!PaintUtilities.equal(this.domainGridlinePaint, \n                that.domainGridlinePaint)) {\n            return false;\n        }\n        if (this.rangeGridlinesVisible != that.rangeGridlinesVisible) {\n            return false;\n        }\n        if (!ObjectUtilities.equal(this.rangeGridlineStroke, \n                that.rangeGridlineStroke)) {\n            return false;\n        }\n        if (!PaintUtilities.equal(this.rangeGridlinePaint, \n                that.rangeGridlinePaint)) {\n            return false;\n        }\n        if (this.anchorValue != that.anchorValue) {\n            return false;\n        }\n        if (this.rangeCrosshairVisible != that.rangeCrosshairVisible) {\n            return false;\n        }\n        if (this.rangeCrosshairValue != that.rangeCrosshairValue) {\n            return false;\n        }\n        if (!ObjectUtilities.equal(this.rangeCrosshairStroke, \n                that.rangeCrosshairStroke)) {\n            return false;\n        }\n        if (!PaintUtilities.equal(this.rangeCrosshairPaint, \n                that.rangeCrosshairPaint)) {\n            return false;\n        }\n        if (this.rangeCrosshairLockedOnData \n                != that.rangeCrosshairLockedOnData) {\n            return false;\n        }      \n        if (!ObjectUtilities.equal(this.foregroundRangeMarkers, \n                that.foregroundRangeMarkers)) {\n            return false;\n        }\n        if (!ObjectUtilities.equal(this.backgroundRangeMarkers, \n                that.backgroundRangeMarkers)) {\n            return false;\n        }\n        if (!ObjectUtilities.equal(this.annotations, that.annotations)) {\n            return false;\n        }\n        if (this.weight != that.weight) {\n            return false;\n        }\n        if (!ObjectUtilities.equal(this.fixedDomainAxisSpace, \n                that.fixedDomainAxisSpace)) {\n            return false;\n        }    \n        if (!ObjectUtilities.equal(this.fixedRangeAxisSpace, \n                that.fixedRangeAxisSpace)) {\n            return false;\n        }    \n        \n        return true;\n        \n    }", "class": "CategoryPlot", "signature": "boolean equals(Object obj)", "full_signature": "public boolean equals(Object obj)", "class_method_signature": "CategoryPlot.equals(Object obj)", "testcase": false, "constructor": false, "invocations": ["equals", "equal", "equals", "equals", "equals", "equals", "equal", "equal", "equal", "equal", "equal", "equal", "equal", "equal", "equal", "equal", "equal", "equal", "equal", "equal"]}