{"identifier": "getDataRange", "parameters": "(ValueAxis axis)", "modifiers": "public", "return": "Range", "body": "public Range getDataRange(ValueAxis axis) {\n\n        Range result = null;\n        List mappedDatasets = new ArrayList();\n        List includedAnnotations = new ArrayList();\n        boolean isDomainAxis = true;\n\n        // is it a domain axis?\n        int domainIndex = getDomainAxisIndex(axis);\n        if (domainIndex >= 0) {\n            isDomainAxis = true;\n            mappedDatasets.addAll(getDatasetsMappedToDomainAxis(\n                    new Integer(domainIndex)));\n            if (domainIndex == 0) {\n                // grab the plot's annotations\n                Iterator iterator = this.annotations.iterator();\n                while (iterator.hasNext()) {\n                    XYAnnotation annotation = (XYAnnotation) iterator.next();\n                    if (annotation instanceof XYAnnotationBoundsInfo) {\n                        includedAnnotations.add(annotation);\n                    }\n                }\n            }\n        }\n\n        // or is it a range axis?\n        int rangeIndex = getRangeAxisIndex(axis);\n        if (rangeIndex >= 0) {\n            isDomainAxis = false;\n            mappedDatasets.addAll(getDatasetsMappedToRangeAxis(\n                    new Integer(rangeIndex)));\n            if (rangeIndex == 0) {\n                Iterator iterator = this.annotations.iterator();\n                while (iterator.hasNext()) {\n                    XYAnnotation annotation = (XYAnnotation) iterator.next();\n                    if (annotation instanceof XYAnnotationBoundsInfo) {\n                        includedAnnotations.add(annotation);\n                    }\n                }\n            }\n        }\n\n        // iterate through the datasets that map to the axis and get the union\n        // of the ranges.\n        Iterator iterator = mappedDatasets.iterator();\n        while (iterator.hasNext()) {\n            XYDataset d = (XYDataset) iterator.next();\n            if (d != null) {\n                XYItemRenderer r = getRendererForDataset(d);\n                if (isDomainAxis) {\n                    if (r != null) {\n                        result = Range.combine(result, r.findDomainBounds(d));\n                    }\n                    else {\n                        result = Range.combine(result,\n                                DatasetUtilities.findDomainBounds(d));\n                    }\n                }\n                else {\n                    if (r != null) {\n                        result = Range.combine(result, r.findRangeBounds(d));\n                    }\n                    else {\n                        result = Range.combine(result,\n                                DatasetUtilities.findRangeBounds(d));\n                    }\n                }\n                \n                if (r != null) {\n                    Collection c = r.getAnnotations();\n                    Iterator i = c.iterator();\n                    while (i.hasNext()) {\n                        XYAnnotation a = (XYAnnotation) i.next();\n                        if (a instanceof XYAnnotationBoundsInfo) {\n                            includedAnnotations.add(a);\n                        }\n                    }\n                }\n            }\n        }\n\n        Iterator it = includedAnnotations.iterator();\n        while (it.hasNext()) {\n            XYAnnotationBoundsInfo xyabi = (XYAnnotationBoundsInfo) it.next();\n            if (xyabi.getIncludeInDataBounds()) {\n                if (isDomainAxis) {\n                    result = Range.combine(result, xyabi.getXRange());\n                }\n                else {\n                    result = Range.combine(result, xyabi.getYRange());\n                }\n            }\n        }\n\n        return result;\n\n    }", "class": "XYPlot", "signature": "Range getDataRange(ValueAxis axis)", "full_signature": "public Range getDataRange(ValueAxis axis)", "class_method_signature": "XYPlot.getDataRange(ValueAxis axis)", "testcase": false, "constructor": false, "invocations": ["getDomainAxisIndex", "addAll", "getDatasetsMappedToDomainAxis", "iterator", "hasNext", "next", "add", "getRangeAxisIndex", "addAll", "getDatasetsMappedToRangeAxis", "iterator", "hasNext", "next", "add", "iterator", "hasNext", "next", "getRendererForDataset", "combine", "findDomainBounds", "combine", "findDomainBounds", "combine", "findRangeBounds", "combine", "findRangeBounds", "getAnnotations", "iterator", "hasNext", "next", "add", "iterator", "hasNext", "next", "getIncludeInDataBounds", "combine", "getXRange", "combine", "getYRange"]}