{"identifier": "createCopy", "parameters": "(int start, int end)", "modifiers": "public", "return": "XYSeries", "body": "public XYSeries createCopy(int start, int end)\n        throws CloneNotSupportedException {\n\n        XYSeries copy = (XYSeries) super.clone();\n        copy.data = new java.util.ArrayList();\n        if (this.data.size() > 0) {\n            for (int index = start; index <= end; index++) {\n                XYDataItem item = (XYDataItem) this.data.get(index);\n                XYDataItem clone = (XYDataItem) item.clone();\n                try {\n                    copy.add(clone);\n                }\n                catch (SeriesException e) {\n                    System.err.println(\"Unable to add cloned data item.\");\n                }\n            }\n        }\n        return copy;\n\n    }", "class": "XYSeries", "signature": "XYSeries createCopy(int start, int end)", "full_signature": "public XYSeries createCopy(int start, int end)", "class_method_signature": "XYSeries.createCopy(int start, int end)", "testcase": false, "constructor": false, "invocations": ["clone", "size", "get", "clone", "add", "println"]}