{"identifier": "validate", "parameters": "(final WriteableCommandLine commandLine,\n                         final Option option)", "modifiers": "public", "return": "void", "body": "public void validate(final WriteableCommandLine commandLine,\n                         final Option option)\n        throws OptionException {\n        final List values = commandLine.getValues(option);\n\n        if (values.size() < minimum) {\n            throw new OptionException(option, ResourceConstants.ARGUMENT_MISSING_VALUES);\n        }\n\n        if (values.size() > maximum) {\n            throw new OptionException(option, ResourceConstants.ARGUMENT_UNEXPECTED_VALUE,\n                                      (String) values.get(maximum));\n        }\n\n        if (validator != null) {\n            try {\n                validator.validate(values);\n            } catch (InvalidArgumentException ive) {\n                throw new OptionException(option, ResourceConstants.ARGUMENT_UNEXPECTED_VALUE,\n                                          ive.getMessage());\n            }\n        }\n    }", "class": "ArgumentImpl", "signature": "void validate(final WriteableCommandLine commandLine,\n                         final Option option)", "full_signature": "public void validate(final WriteableCommandLine commandLine,\n                         final Option option)", "class_method_signature": "ArgumentImpl.validate(final WriteableCommandLine commandLine,\n                         final Option option)", "testcase": false, "constructor": false, "invocations": ["getValues", "size", "size", "get", "validate", "getMessage"]}