{"identifier": "draw", "parameters": "(Graphics2D g2, Rectangle2D area, Point2D anchor,\n            PlotState parentState, PlotRenderingInfo info)", "modifiers": "public", "return": "void", "body": "public void draw(Graphics2D g2, Rectangle2D area, Point2D anchor,\n            PlotState parentState, PlotRenderingInfo info) {\n\n        // if the plot area is too small, just return...\n        boolean b1 = (area.getWidth() <= MINIMUM_WIDTH_TO_DRAW);\n        boolean b2 = (area.getHeight() <= MINIMUM_HEIGHT_TO_DRAW);\n        if (b1 || b2) {\n            return;\n        }\n\n        // record the plot area...\n        if (info != null) {\n            info.setPlotArea(area);\n        }\n\n        // adjust the drawing area for the plot insets (if any)...\n        RectangleInsets insets = getInsets();\n        insets.trim(area);\n\n        AxisSpace space = calculateAxisSpace(g2, area);\n        Rectangle2D dataArea = space.shrink(area, null);\n        this.axisOffset.trim(dataArea);\n        createAndAddEntity((Rectangle2D) dataArea.clone(), info, null, null);\n        if (info != null) {\n            info.setDataArea(dataArea);\n        }\n\n        // draw the plot background and axes...\n        drawBackground(g2, dataArea);\n        Map axisStateMap = drawAxes(g2, area, dataArea, info);\n\n        PlotOrientation orient = getOrientation();\n\n        // the anchor point is typically the point where the mouse last\n        // clicked - the crosshairs will be driven off this point...\n        if (anchor != null && !dataArea.contains(anchor)) {\n            anchor = null;\n        }\n        CrosshairState crosshairState = new CrosshairState();\n        crosshairState.setCrosshairDistance(Double.POSITIVE_INFINITY);\n        crosshairState.setAnchor(anchor);\n\n        crosshairState.setAnchorX(Double.NaN);\n        crosshairState.setAnchorY(Double.NaN);\n        if (anchor != null) {\n            ValueAxis domainAxis = getDomainAxis();\n            if (domainAxis != null) {\n                double x;\n                if (orient == PlotOrientation.VERTICAL) {\n                    x = domainAxis.java2DToValue(anchor.getX(), dataArea,\n                            getDomainAxisEdge());\n                }\n                else {\n                    x = domainAxis.java2DToValue(anchor.getY(), dataArea,\n                            getDomainAxisEdge());\n                }\n                crosshairState.setAnchorX(x);\n            }\n            ValueAxis rangeAxis = getRangeAxis();\n            if (rangeAxis != null) {\n                double y;\n                if (orient == PlotOrientation.VERTICAL) {\n                    y = rangeAxis.java2DToValue(anchor.getY(), dataArea,\n                            getRangeAxisEdge());\n                }\n                else {\n                    y = rangeAxis.java2DToValue(anchor.getX(), dataArea,\n                            getRangeAxisEdge());\n                }\n                crosshairState.setAnchorY(y);\n            }\n        }\n        crosshairState.setCrosshairX(getDomainCrosshairValue());\n        crosshairState.setCrosshairY(getRangeCrosshairValue());\n        Shape originalClip = g2.getClip();\n        Composite originalComposite = g2.getComposite();\n\n        g2.clip(dataArea);\n        g2.setComposite(AlphaComposite.getInstance(AlphaComposite.SRC_OVER,\n                getForegroundAlpha()));\n\n        AxisState domainAxisState = (AxisState) axisStateMap.get(\n                getDomainAxis());\n        if (domainAxisState == null) {\n            if (parentState != null) {\n                domainAxisState = (AxisState) parentState.getSharedAxisStates()\n                        .get(getDomainAxis());\n            }\n        }\n\n        AxisState rangeAxisState = (AxisState) axisStateMap.get(getRangeAxis());\n        if (rangeAxisState == null) {\n            if (parentState != null) {\n                rangeAxisState = (AxisState) parentState.getSharedAxisStates()\n                        .get(getRangeAxis());\n            }\n        }\n        if (domainAxisState != null) {\n            drawDomainTickBands(g2, dataArea, domainAxisState.getTicks());\n        }\n        if (rangeAxisState != null) {\n            drawRangeTickBands(g2, dataArea, rangeAxisState.getTicks());\n        }\n        if (domainAxisState != null) {\n            drawDomainGridlines(g2, dataArea, domainAxisState.getTicks());\n            drawZeroDomainBaseline(g2, dataArea);\n        }\n        if (rangeAxisState != null) {\n            drawRangeGridlines(g2, dataArea, rangeAxisState.getTicks());\n            drawZeroRangeBaseline(g2, dataArea);\n        }\n\n        // draw the markers that are associated with a specific renderer...\n        for (int i = 0; i < this.renderers.size(); i++) {\n            drawDomainMarkers(g2, dataArea, i, Layer.BACKGROUND);\n        }\n        for (int i = 0; i < this.renderers.size(); i++) {\n            drawRangeMarkers(g2, dataArea, i, Layer.BACKGROUND);\n        }\n\n        // now draw annotations and render data items...\n        boolean foundData = false;\n        DatasetRenderingOrder order = getDatasetRenderingOrder();\n        if (order == DatasetRenderingOrder.FORWARD) {\n\n            // draw background annotations\n            int rendererCount = this.renderers.size();\n            for (int i = 0; i < rendererCount; i++) {\n                XYItemRenderer r = getRenderer(i);\n                if (r != null) {\n                    ValueAxis domainAxis = getDomainAxisForDataset(i);\n                    ValueAxis rangeAxis = getRangeAxisForDataset(i);\n                    r.drawAnnotations(g2, dataArea, domainAxis, rangeAxis,\n                            Layer.BACKGROUND, info);\n                }\n            }\n\n            // render data items...\n            for (int i = 0; i < getDatasetCount(); i++) {\n                foundData = render(g2, dataArea, i, info, crosshairState)\n                    || foundData;\n            }\n\n            // draw foreground annotations\n            for (int i = 0; i < rendererCount; i++) {\n                XYItemRenderer r = getRenderer(i);\n                if (r != null) {\n                    ValueAxis domainAxis = getDomainAxisForDataset(i);\n                    ValueAxis rangeAxis = getRangeAxisForDataset(i);\n                    r.drawAnnotations(g2, dataArea, domainAxis, rangeAxis,\n                            Layer.FOREGROUND, info);\n                }\n            }\n\n        }\n        else if (order == DatasetRenderingOrder.REVERSE) {\n\n            // draw background annotations\n            int rendererCount = this.renderers.size();\n            for (int i = rendererCount - 1; i >= 0; i--) {\n                XYItemRenderer r = getRenderer(i);\n                if (i >= getDatasetCount()) { // we need the dataset to make\n                    continue;                 // a link to the axes\n                }\n                if (r != null) {\n                    ValueAxis domainAxis = getDomainAxisForDataset(i);\n                    ValueAxis rangeAxis = getRangeAxisForDataset(i);\n                    r.drawAnnotations(g2, dataArea, domainAxis, rangeAxis,\n                            Layer.BACKGROUND, info);\n                }\n            }\n\n            for (int i = getDatasetCount() - 1; i >= 0; i--) {\n                foundData = render(g2, dataArea, i, info, crosshairState)\n                    || foundData;\n            }\n\n            // draw foreground annotations\n            for (int i = rendererCount - 1; i >= 0; i--) {\n                XYItemRenderer r = getRenderer(i);\n                if (i >= getDatasetCount()) { // we need the dataset to make\n                    continue;                 // a link to the axes\n                }\n                if (r != null) {\n                    ValueAxis domainAxis = getDomainAxisForDataset(i);\n                    ValueAxis rangeAxis = getRangeAxisForDataset(i);\n                    r.drawAnnotations(g2, dataArea, domainAxis, rangeAxis,\n                            Layer.FOREGROUND, info);\n                }\n            }\n\n        }\n\n        // draw domain crosshair if required...\n        int xAxisIndex = crosshairState.getDomainAxisIndex();\n        ValueAxis xAxis = getDomainAxis(xAxisIndex);\n        RectangleEdge xAxisEdge = getDomainAxisEdge(xAxisIndex);\n        if (!this.domainCrosshairLockedOnData && anchor != null) {\n            double xx;\n            if (orient == PlotOrientation.VERTICAL) {\n                xx = xAxis.java2DToValue(anchor.getX(), dataArea, xAxisEdge);\n            }\n            else {\n                xx = xAxis.java2DToValue(anchor.getY(), dataArea, xAxisEdge);\n            }\n            crosshairState.setCrosshairX(xx);\n        }\n        setDomainCrosshairValue(crosshairState.getCrosshairX(), false);\n        if (isDomainCrosshairVisible()) {\n            double x = getDomainCrosshairValue();\n            Paint paint = getDomainCrosshairPaint();\n            Stroke stroke = getDomainCrosshairStroke();\n            drawDomainCrosshair(g2, dataArea, orient, x, xAxis, stroke, paint);\n        }\n\n        // draw range crosshair if required...\n        int yAxisIndex = crosshairState.getRangeAxisIndex();\n        ValueAxis yAxis = getRangeAxis(yAxisIndex);\n        RectangleEdge yAxisEdge = getRangeAxisEdge(yAxisIndex);\n        if (!this.rangeCrosshairLockedOnData && anchor != null) {\n            double yy;\n            if (orient == PlotOrientation.VERTICAL) {\n                yy = yAxis.java2DToValue(anchor.getY(), dataArea, yAxisEdge);\n            } else {\n                yy = yAxis.java2DToValue(anchor.getX(), dataArea, yAxisEdge);\n            }\n            crosshairState.setCrosshairY(yy);\n        }\n        setRangeCrosshairValue(crosshairState.getCrosshairY(), false);\n        if (isRangeCrosshairVisible()) {\n            double y = getRangeCrosshairValue();\n            Paint paint = getRangeCrosshairPaint();\n            Stroke stroke = getRangeCrosshairStroke();\n            drawRangeCrosshair(g2, dataArea, orient, y, yAxis, stroke, paint);\n        }\n\n        if (!foundData) {\n            drawNoDataMessage(g2, dataArea);\n        }\n\n        for (int i = 0; i < this.renderers.size(); i++) {\n            drawDomainMarkers(g2, dataArea, i, Layer.FOREGROUND);\n        }\n        for (int i = 0; i < this.renderers.size(); i++) {\n            drawRangeMarkers(g2, dataArea, i, Layer.FOREGROUND);\n        }\n\n        drawAnnotations(g2, dataArea, info);\n        g2.setClip(originalClip);\n        g2.setComposite(originalComposite);\n\n        drawOutline(g2, dataArea);\n\n    }", "class": "XYPlot", "signature": "void draw(Graphics2D g2, Rectangle2D area, Point2D anchor,\n            PlotState parentState, PlotRenderingInfo info)", "full_signature": "public void draw(Graphics2D g2, Rectangle2D area, Point2D anchor,\n            PlotState parentState, PlotRenderingInfo info)", "class_method_signature": "XYPlot.draw(Graphics2D g2, Rectangle2D area, Point2D anchor,\n            PlotState parentState, PlotRenderingInfo info)", "testcase": false, "constructor": false, "invocations": ["getWidth", "getHeight", "setPlotArea", "getInsets", "trim", "calculateAxisSpace", "shrink", "trim", "createAndAddEntity", "clone", "setDataArea", "drawBackground", "drawAxes", "getOrientation", "contains", "setCrosshairDistance", "setAnchor", "setAnchorX", "setAnchorY", "getDomainAxis", "java2DToValue", "getX", "getDomainAxisEdge", "java2DToValue", "getY", "getDomainAxisEdge", "setAnchorX", "getRangeAxis", "java2DToValue", "getY", "getRangeAxisEdge", "java2DToValue", "getX", "getRangeAxisEdge", "setAnchorY", "setCrosshairX", "getDomainCrosshairValue", "setCrosshairY", "getRangeCrosshairValue", "getClip", "getComposite", "clip", "setComposite", "getInstance", "getForegroundAlpha", "get", "getDomainAxis", "get", "getSharedAxisStates", "getDomainAxis", "get", "getRangeAxis", "get", "getSharedAxisStates", "getRangeAxis", "drawDomainTickBands", "getTicks", "drawRangeTickBands", "getTicks", "drawDomainGridlines", "getTicks", "drawZeroDomainBaseline", "drawRangeGridlines", "getTicks", "drawZeroRangeBaseline", "size", "drawDomainMarkers", "size", "drawRangeMarkers", "getDatasetRenderingOrder", "size", "getRenderer", "getDomainAxisForDataset", "getRangeAxisForDataset", "drawAnnotations", "getDatasetCount", "render", "getRenderer", "getDomainAxisForDataset", "getRangeAxisForDataset", "drawAnnotations", "size", "getRenderer", "getDatasetCount", "getDomainAxisForDataset", "getRangeAxisForDataset", "drawAnnotations", "getDatasetCount", "render", "getRenderer", "getDatasetCount", "getDomainAxisForDataset", "getRangeAxisForDataset", "drawAnnotations", "getDomainAxisIndex", "getDomainAxis", "getDomainAxisEdge", "java2DToValue", "getX", "java2DToValue", "getY", "setCrosshairX", "setDomainCrosshairValue", "getCrosshairX", "isDomainCrosshairVisible", "getDomainCrosshairValue", "getDomainCrosshairPaint", "getDomainCrosshairStroke", "drawDomainCrosshair", "getRangeAxisIndex", "getRangeAxis", "getRangeAxisEdge", "java2DToValue", "getY", "java2DToValue", "getX", "setCrosshairY", "setRangeCrosshairValue", "getCrosshairY", "isRangeCrosshairVisible", "getRangeCrosshairValue", "getRangeCrosshairPaint", "getRangeCrosshairStroke", "drawRangeCrosshair", "drawNoDataMessage", "size", "drawDomainMarkers", "size", "drawRangeMarkers", "drawAnnotations", "setClip", "setComposite", "drawOutline"]}