{"identifier": "add", "parameters": "(BoxAndWhiskerItem item, Comparable rowKey, \n            Comparable columnKey)", "modifiers": "public", "return": "void", "body": "public void add(BoxAndWhiskerItem item, Comparable rowKey, \n            Comparable columnKey) {\n\n        this.data.addObject(item, rowKey, columnKey);\n        \n        // update cached min and max values\n        int r = this.data.getRowIndex(rowKey);\n        int c = this.data.getColumnIndex(columnKey);\n        if ((this.maximumRangeValueRow == r && this.maximumRangeValueColumn \n                == c) || (this.minimumRangeValueRow == r \n                && this.minimumRangeValueColumn == c))  {\n            updateBounds();\n        }\n        else {\n        \n            double minval = Double.NaN;\n            if (item.getMinOutlier() != null) {\n                minval = item.getMinOutlier().doubleValue();\n            }\n            double maxval = Double.NaN;\n            if (item.getMaxOutlier() != null) {\n                maxval = item.getMaxOutlier().doubleValue();\n            }\n        \n            if (Double.isNaN(this.maximumRangeValue)) {\n                this.maximumRangeValue = maxval;\n                this.maximumRangeValueRow = r;\n                this.maximumRangeValueColumn = c;\n            }\n            else if (maxval > this.maximumRangeValue) {\n                this.maximumRangeValue = maxval;\n                this.maximumRangeValueRow = r;\n                this.maximumRangeValueColumn = c;\n            }\n        \n            if (Double.isNaN(this.minimumRangeValue)) {\n                this.minimumRangeValue = minval;\n                this.minimumRangeValueRow = r;\n                this.minimumRangeValueColumn = c;\n            }\n            else if (minval < this.minimumRangeValue) {\n                this.minimumRangeValue = minval;\n                this.minimumRangeValueRow = r;\n                this.minimumRangeValueColumn = c;\n            }\n        }\n        \n        this.rangeBounds = new Range(this.minimumRangeValue,\n              this.maximumRangeValue);\n        fireDatasetChanged();\n\n    }", "class": "DefaultBoxAndWhiskerCategoryDataset", "signature": "void add(BoxAndWhiskerItem item, Comparable rowKey, \n            Comparable columnKey)", "full_signature": "public void add(BoxAndWhiskerItem item, Comparable rowKey, \n            Comparable columnKey)", "class_method_signature": "DefaultBoxAndWhiskerCategoryDataset.add(BoxAndWhiskerItem item, Comparable rowKey, \n            Comparable columnKey)", "testcase": false, "constructor": false, "invocations": ["addObject", "getRowIndex", "getColumnIndex", "updateBounds", "getMinOutlier", "doubleValue", "getMinOutlier", "getMaxOutlier", "doubleValue", "getMaxOutlier", "isNaN", "isNaN", "fireDatasetChanged"]}