{"identifier": "setStartValue", "parameters": "(int series, Comparable category, Number value)", "modifiers": "public", "return": "void", "body": "public void setStartValue(int series, Comparable category, Number value) {\n\n        // does the series exist?\n        if ((series < 0) || (series > getSeriesCount() - 1)) {\n            throw new IllegalArgumentException(\n                \"DefaultIntervalCategoryDataset.setValue: \"\n                + \"series outside valid range.\");\n        }\n\n        // is the category valid?\n        int categoryIndex = getCategoryIndex(category);\n        if (categoryIndex < 0) {\n            throw new IllegalArgumentException(\n                \"DefaultIntervalCategoryDataset.setValue: \"\n                + \"unrecognised category.\");\n        }\n\n        // update the data...\n        this.startData[series][categoryIndex] = value;\n        fireDatasetChanged();\n\n    }", "class": "DefaultIntervalCategoryDataset", "signature": "void setStartValue(int series, Comparable category, Number value)", "full_signature": "public void setStartValue(int series, Comparable category, Number value)", "class_method_signature": "DefaultIntervalCategoryDataset.setStartValue(int series, Comparable category, Number value)", "testcase": false, "constructor": false, "invocations": ["getSeriesCount", "getCategoryIndex", "fireDatasetChanged"]}