{"identifier": "createCopy", "parameters": "(int start, int end)", "modifiers": "public", "return": "TimePeriodValues", "body": "public TimePeriodValues createCopy(int start, int end) \n        throws CloneNotSupportedException {\n\n        TimePeriodValues copy = (TimePeriodValues) super.clone();\n\n        copy.data = new ArrayList();\n        if (this.data.size() > 0) {\n            for (int index = start; index <= end; index++) {\n                TimePeriodValue item = (TimePeriodValue) this.data.get(index);\n                TimePeriodValue clone = (TimePeriodValue) item.clone();\n                try {\n                    copy.add(clone);\n                }\n                catch (SeriesException e) {\n                    System.err.println(\"Failed to add cloned item.\");\n                }\n            }\n        }\n        return copy;\n\n    }", "class": "TimePeriodValues", "signature": "TimePeriodValues createCopy(int start, int end)", "full_signature": "public TimePeriodValues createCopy(int start, int end)", "class_method_signature": "TimePeriodValues.createCopy(int start, int end)", "testcase": false, "constructor": false, "invocations": ["clone", "size", "get", "clone", "add", "println"]}