{"identifier": "stripAccents", "parameters": "(String input)", "modifiers": "public static", "return": "String", "body": "public static String stripAccents(String input) {\n        if(input == null) {\n            return null;\n        }\n        try {\n            String result = null;\n            if (java6Available) {\n                result = removeAccentsJava6(input);\n            } else if (sunAvailable) {\n                result = removeAccentsSUN(input);\n            } else {\n                throw new UnsupportedOperationException(\n                    \"The stripAccents(CharSequence) method requires at least Java 1.6 or a Sun JVM\");\n            }\n            // Note that none of the above methods correctly remove ligatures...\n            return result;\n        } catch(IllegalArgumentException iae) {\n            throw new RuntimeException(\"IllegalArgumentException occurred\", iae);\n        } catch(IllegalAccessException iae) {\n            throw new RuntimeException(\"IllegalAccessException occurred\", iae);\n        } catch(InvocationTargetException ite) {\n            throw new RuntimeException(\"InvocationTargetException occurred\", ite);\n        } catch(SecurityException se) {\n            throw new RuntimeException(\"SecurityException occurred\", se);\n        }\n    }", "class": "StringUtils", "signature": "String stripAccents(String input)", "full_signature": "public static String stripAccents(String input)", "class_method_signature": "StringUtils.stripAccents(String input)", "testcase": false, "constructor": false, "invocations": ["removeAccentsJava6", "removeAccentsSUN"]}