{"identifier": "equals", "parameters": "(Object obj)", "modifiers": "public", "return": "boolean", "body": "public boolean equals(Object obj) {\n        if (obj == this) {\n            return true;\n        }\n        if (!(obj instanceof TimeSeries)) {\n            return false;\n        }\n        TimeSeries that = (TimeSeries) obj;\n        if (!ObjectUtilities.equal(getDomainDescription(),\n                that.getDomainDescription())) {\n            return false;\n        }\n        if (!ObjectUtilities.equal(getRangeDescription(),\n                that.getRangeDescription())) {\n            return false;\n        }\n        if (!ObjectUtilities.equal(this.timePeriodClass,\n                that.timePeriodClass)) {\n            return false;\n        }\n        if (getMaximumItemAge() != that.getMaximumItemAge()) {\n            return false;\n        }\n        if (getMaximumItemCount() != that.getMaximumItemCount()) {\n            return false;\n        }\n        int count = getItemCount();\n        if (count != that.getItemCount()) {\n            return false;\n        }\n        if (!ObjectUtilities.equal(this.data, that.data)) {\n            return false;\n        }\n        return super.equals(obj);\n    }", "class": "TimeSeries", "signature": "boolean equals(Object obj)", "full_signature": "public boolean equals(Object obj)", "class_method_signature": "TimeSeries.equals(Object obj)", "testcase": false, "constructor": false, "invocations": ["equal", "getDomainDescription", "getDomainDescription", "equal", "getRangeDescription", "getRangeDescription", "equal", "getMaximumItemAge", "getMaximumItemAge", "getMaximumItemCount", "getMaximumItemCount", "getItemCount", "getItemCount", "equal", "equals"]}