{"identifier": "clearRangeMarkers", "parameters": "()", "modifiers": "public", "return": "void", "body": "public void clearRangeMarkers() {\n        if (this.backgroundRangeMarkers != null) {\n            Set keys = this.backgroundRangeMarkers.keySet();\n            Iterator iterator = keys.iterator();\n            while (iterator.hasNext()) {\n                Integer key = (Integer) iterator.next();\n                clearRangeMarkers(key.intValue());\n            }\n            this.backgroundRangeMarkers.clear();\n        }\n        if (this.foregroundRangeMarkers != null) {\n            Set keys = this.foregroundRangeMarkers.keySet();\n            Iterator iterator = keys.iterator();\n            while (iterator.hasNext()) {\n                Integer key = (Integer) iterator.next();\n                clearRangeMarkers(key.intValue());\n            }\n            this.foregroundRangeMarkers.clear();\n        }\n        fireChangeEvent();\n    }", "class": "CategoryPlot", "signature": "void clearRangeMarkers()", "full_signature": "public void clearRangeMarkers()", "class_method_signature": "CategoryPlot.clearRangeMarkers()", "testcase": false, "constructor": false, "invocations": ["keySet", "iterator", "hasNext", "next", "clearRangeMarkers", "intValue", "clear", "keySet", "iterator", "hasNext", "next", "clearRangeMarkers", "intValue", "clear", "fireChangeEvent"]}