{"identifier": "createCategoryDataset", "parameters": "(Comparable rowKey,\n                                                        KeyedValues rowData)", "modifiers": "public static", "return": "CategoryDataset", "body": "public static CategoryDataset createCategoryDataset(Comparable rowKey,\n                                                        KeyedValues rowData) {\n\n        if (rowKey == null) {\n            throw new IllegalArgumentException(\"Null 'rowKey' argument.\");\n        }\n        if (rowData == null) {\n            throw new IllegalArgumentException(\"Null 'rowData' argument.\");\n        }\n        DefaultCategoryDataset result = new DefaultCategoryDataset();\n        for (int i = 0; i < rowData.getItemCount(); i++) {\n            result.addValue(rowData.getValue(i), rowKey, rowData.getKey(i));\n        }\n        return result;\n\n    }", "class": "DatasetUtilities", "signature": "CategoryDataset createCategoryDataset(Comparable rowKey,\n                                                        KeyedValues rowData)", "full_signature": "public static CategoryDataset createCategoryDataset(Comparable rowKey,\n                                                        KeyedValues rowData)", "class_method_signature": "DatasetUtilities.createCategoryDataset(Comparable rowKey,\n                                                        KeyedValues rowData)", "testcase": false, "constructor": false, "invocations": ["getItemCount", "addValue", "getValue", "getKey"]}