{"identifier": "clone", "parameters": "()", "modifiers": "public", "return": "Object", "body": "public Object clone() throws CloneNotSupportedException {\n\n        AbstractCategoryItemRenderer clone\n                = (AbstractCategoryItemRenderer) super.clone();\n\n\n        if (this.itemLabelGeneratorList != null) {\n            clone.itemLabelGeneratorList\n                    = (ObjectList) this.itemLabelGeneratorList.clone();\n        }\n\n        if (this.baseItemLabelGenerator != null) {\n            if (this.baseItemLabelGenerator instanceof PublicCloneable) {\n                PublicCloneable pc\n                        = (PublicCloneable) this.baseItemLabelGenerator;\n                clone.baseItemLabelGenerator\n                        = (CategoryItemLabelGenerator) pc.clone();\n            }\n            else {\n                throw new CloneNotSupportedException(\n                        \"ItemLabelGenerator not cloneable.\");\n            }\n        }\n\n        if (this.toolTipGeneratorList != null) {\n            clone.toolTipGeneratorList\n                    = (ObjectList) this.toolTipGeneratorList.clone();\n        }\n\n        if (this.baseToolTipGenerator != null) {\n            if (this.baseToolTipGenerator instanceof PublicCloneable) {\n                PublicCloneable pc\n                        = (PublicCloneable) this.baseToolTipGenerator;\n                clone.baseToolTipGenerator\n                        = (CategoryToolTipGenerator) pc.clone();\n            }\n            else {\n                throw new CloneNotSupportedException(\n                        \"Base tool tip generator not cloneable.\");\n            }\n        }\n\n        if (this.urlGeneratorList != null) {\n            clone.urlGeneratorList = (ObjectList) this.urlGeneratorList.clone();\n        }\n\n        if (this.baseURLGenerator != null) {\n            if (this.baseURLGenerator instanceof PublicCloneable) {\n                PublicCloneable pc = (PublicCloneable) this.baseURLGenerator;\n                clone.baseURLGenerator = (CategoryURLGenerator) pc.clone();\n            }\n            else {\n                throw new CloneNotSupportedException(\n                        \"Base item URL generator not cloneable.\");\n            }\n        }\n\n        if (this.legendItemLabelGenerator instanceof PublicCloneable) {\n            clone.legendItemLabelGenerator = (CategorySeriesLabelGenerator)\n                    ObjectUtilities.clone(this.legendItemLabelGenerator);\n        }\n        if (this.legendItemToolTipGenerator instanceof PublicCloneable) {\n            clone.legendItemToolTipGenerator = (CategorySeriesLabelGenerator)\n                    ObjectUtilities.clone(this.legendItemToolTipGenerator);\n        }\n        if (this.legendItemURLGenerator instanceof PublicCloneable) {\n            clone.legendItemURLGenerator = (CategorySeriesLabelGenerator)\n                    ObjectUtilities.clone(this.legendItemURLGenerator);\n        }\n        return clone;\n    }", "class": "AbstractCategoryItemRenderer", "signature": "Object clone()", "full_signature": "public Object clone()", "class_method_signature": "AbstractCategoryItemRenderer.clone()", "testcase": false, "constructor": false, "invocations": ["clone", "clone", "clone", "clone", "clone", "clone", "clone", "clone", "clone", "clone"]}