{"identifier": "drawAnnotations", "parameters": "(Graphics2D g2, Rectangle2D dataArea,\n            CategoryAxis domainAxis, ValueAxis rangeAxis, Layer layer,\n            PlotRenderingInfo info)", "modifiers": "public", "return": "void", "body": "public void drawAnnotations(Graphics2D g2, Rectangle2D dataArea,\n            CategoryAxis domainAxis, ValueAxis rangeAxis, Layer layer,\n            PlotRenderingInfo info) {\n\n        Iterator iterator = null;\n        if (layer.equals(Layer.FOREGROUND)) {\n            iterator = this.foregroundAnnotations.iterator();\n        }\n        else if (layer.equals(Layer.BACKGROUND)) {\n            iterator = this.backgroundAnnotations.iterator();\n        }\n        else {\n            // should not get here\n            throw new RuntimeException(\"Unknown layer.\");\n        }\n        while (iterator.hasNext()) {\n            CategoryAnnotation annotation = (CategoryAnnotation) iterator.next();\n            annotation.draw(g2, this.plot, dataArea, domainAxis, rangeAxis,\n                    0, info);\n        }\n\n    }", "class": "AbstractCategoryItemRenderer", "signature": "void drawAnnotations(Graphics2D g2, Rectangle2D dataArea,\n            CategoryAxis domainAxis, ValueAxis rangeAxis, Layer layer,\n            PlotRenderingInfo info)", "full_signature": "public void drawAnnotations(Graphics2D g2, Rectangle2D dataArea,\n            CategoryAxis domainAxis, ValueAxis rangeAxis, Layer layer,\n            PlotRenderingInfo info)", "class_method_signature": "AbstractCategoryItemRenderer.drawAnnotations(Graphics2D g2, Rectangle2D dataArea,\n            CategoryAxis domainAxis, ValueAxis rangeAxis, Layer layer,\n            PlotRenderingInfo info)", "testcase": false, "constructor": false, "invocations": ["equals", "iterator", "equals", "iterator", "hasNext", "next", "draw"]}