{"identifier": "getValue", "parameters": "(Comparable rowKey, Comparable columnKey)", "modifiers": "public", "return": "Number", "body": "public Number getValue(Comparable rowKey, Comparable columnKey) {\n        if (rowKey == null) {\n            throw new IllegalArgumentException(\"Null 'rowKey' argument.\");\n        }\n        if (columnKey == null) {\n            throw new IllegalArgumentException(\"Null 'columnKey' argument.\");\n        }\n        \n        // check that the column key is defined in the 2D structure\n        if (!(this.columnKeys.contains(columnKey))) {\n            throw new UnknownKeyException(\"Unrecognised columnKey: \" \n                    + columnKey);\n        }\n        \n        // now fetch the row data - need to bear in mind that the row\n        // structure may not have an entry for the column key, but that we\n        // have already checked that the key is valid for the 2D structure\n        int row = getRowIndex(rowKey);\n        if (row >= 0) {\n            DefaultKeyedValues rowData \n                = (DefaultKeyedValues) this.rows.get(row);\n            int col = rowData.getIndex(columnKey);\n            return (col >= 0 ? rowData.getValue(col) : null);\n        }\n        else {\n            throw new UnknownKeyException(\"Unrecognised rowKey: \" + rowKey);\n        }\n    }", "class": "DefaultKeyedValues2D", "signature": "Number getValue(Comparable rowKey, Comparable columnKey)", "full_signature": "public Number getValue(Comparable rowKey, Comparable columnKey)", "class_method_signature": "DefaultKeyedValues2D.getValue(Comparable rowKey, Comparable columnKey)", "testcase": false, "constructor": false, "invocations": ["contains", "getRowIndex", "get", "getIndex", "getValue"]}