{"identifier": "iterateDomainBounds", "parameters": "(XYDataset dataset,\n                                            boolean includeInterval)", "modifiers": "public static", "return": "Range", "body": "public static Range iterateDomainBounds(XYDataset dataset,\n                                            boolean includeInterval) {\n        if (dataset == null) {\n            throw new IllegalArgumentException(\"Null 'dataset' argument.\");\n        }\n        double minimum = Double.POSITIVE_INFINITY;\n        double maximum = Double.NEGATIVE_INFINITY;\n        int seriesCount = dataset.getSeriesCount();\n        double lvalue;\n        double uvalue;\n        if (includeInterval && dataset instanceof IntervalXYDataset) {\n            IntervalXYDataset intervalXYData = (IntervalXYDataset) dataset;\n            for (int series = 0; series < seriesCount; series++) {\n                int itemCount = dataset.getItemCount(series);\n                for (int item = 0; item < itemCount; item++) {\n                    double value = intervalXYData.getXValue(series, item);\n                    lvalue = intervalXYData.getStartXValue(series, item);\n                    uvalue = intervalXYData.getEndXValue(series, item);\n                    if (!Double.isNaN(value)) {\n                        minimum = Math.min(minimum, value);\n                        maximum = Math.max(maximum, value);\n                    }\n                    if (!Double.isNaN(lvalue)) {\n                        minimum = Math.min(minimum, lvalue);\n                        maximum = Math.max(maximum, lvalue);\n                    }\n                    if (!Double.isNaN(uvalue)) {\n                        minimum = Math.min(minimum, uvalue);\n                        maximum = Math.max(maximum, uvalue);\n                    }\n                }\n            }\n        }\n        else {\n            for (int series = 0; series < seriesCount; series++) {\n                int itemCount = dataset.getItemCount(series);\n                for (int item = 0; item < itemCount; item++) {\n                    lvalue = dataset.getXValue(series, item);\n                    uvalue = lvalue;\n                    if (!Double.isNaN(lvalue)) {\n                        minimum = Math.min(minimum, lvalue);\n                        maximum = Math.max(maximum, uvalue);\n                    }\n                }\n            }\n        }\n        if (minimum > maximum) {\n            return null;\n        }\n        else {\n            return new Range(minimum, maximum);\n        }\n    }", "class": "DatasetUtilities", "signature": "Range iterateDomainBounds(XYDataset dataset,\n                                            boolean includeInterval)", "full_signature": "public static Range iterateDomainBounds(XYDataset dataset,\n                                            boolean includeInterval)", "class_method_signature": "DatasetUtilities.iterateDomainBounds(XYDataset dataset,\n                                            boolean includeInterval)", "testcase": false, "constructor": false, "invocations": ["getSeriesCount", "getItemCount", "getXValue", "getStartXValue", "getEndXValue", "isNaN", "min", "max", "isNaN", "min", "max", "isNaN", "min", "max", "getItemCount", "getXValue", "isNaN", "min", "max"]}