{"identifier": "parse", "parameters": "(String source)", "modifiers": "@Override public", "return": "Date", "body": "@Override\n    public Date parse(String source) throws ParseException {\n        Date date= parse(source, new ParsePosition(0));\n        if(date==null) {\n            // Add a note re supported date range\n            if (locale.equals(JAPANESE_IMPERIAL)) {\n                throw new ParseException(\n                        \"(The \" +locale + \" locale does not support dates before 1868 AD)\\n\" +\n                                \"Unparseable date: \\\"\"+source+\"\\\" does not match \"+parsePattern.pattern(), 0);\n            }\n            throw new ParseException(\"Unparseable date: \\\"\"+source+\"\\\" does not match \"+parsePattern.pattern(), 0);\n        }\n        return date;\n    }", "class": "FastDateParser", "signature": "Date parse(String source)", "full_signature": "@Override public Date parse(String source)", "class_method_signature": "FastDateParser.parse(String source)", "testcase": false, "constructor": false, "invocations": ["parse", "equals", "pattern", "pattern"]}