{"identifier": "setValue", "parameters": "(Number value, Comparable rowKey, \n                         Comparable columnKey)", "modifiers": "public", "return": "void", "body": "public void setValue(Number value, Comparable rowKey, \n                         Comparable columnKey) {\n\n        DefaultKeyedValues row;\n        int rowIndex = getRowIndex(rowKey);\n        \n        if (rowIndex >= 0) {\n            row = (DefaultKeyedValues) this.rows.get(rowIndex);\n        }\n        else {\n            row = new DefaultKeyedValues();\n            if (this.sortRowKeys) {\n                rowIndex = -rowIndex - 1;\n                this.rowKeys.add(rowIndex, rowKey);\n                this.rows.add(rowIndex, row);\n            }\n            else {\n                this.rowKeys.add(rowKey);\n                this.rows.add(row);\n            }\n        }\n        row.setValue(columnKey, value);\n        \n        int columnIndex = this.columnKeys.indexOf(columnKey);\n        if (columnIndex < 0) {\n            this.columnKeys.add(columnKey);\n        }\n    }", "class": "DefaultKeyedValues2D", "signature": "void setValue(Number value, Comparable rowKey, \n                         Comparable columnKey)", "full_signature": "public void setValue(Number value, Comparable rowKey, \n                         Comparable columnKey)", "class_method_signature": "DefaultKeyedValues2D.setValue(Number value, Comparable rowKey, \n                         Comparable columnKey)", "testcase": false, "constructor": false, "invocations": ["getRowIndex", "get", "add", "add", "add", "add", "setValue", "indexOf", "add"]}