{"identifier": "toBooleanObject", "parameters": "(String str)", "modifiers": "public static", "return": "Boolean", "body": "public static Boolean toBooleanObject(String str) {\n        if (\"true\".equalsIgnoreCase(str)) {\n            return Boolean.TRUE;\n        } else if (\"false\".equalsIgnoreCase(str)) {\n            return Boolean.FALSE;\n        } else if (\"on\".equalsIgnoreCase(str)) {\n            return Boolean.TRUE;\n        } else if (\"off\".equalsIgnoreCase(str)) {\n            return Boolean.FALSE;\n        } else if (\"yes\".equalsIgnoreCase(str)) {\n            return Boolean.TRUE;\n        } else if (\"no\".equalsIgnoreCase(str)) {\n            return Boolean.FALSE;\n        }\n        // no match\n        return null;\n    }", "class": "BooleanUtils", "signature": "Boolean toBooleanObject(String str)", "full_signature": "public static Boolean toBooleanObject(String str)", "class_method_signature": "BooleanUtils.toBooleanObject(String str)", "testcase": false, "constructor": false, "invocations": ["equalsIgnoreCase", "equalsIgnoreCase", "equalsIgnoreCase", "equalsIgnoreCase", "equalsIgnoreCase", "equalsIgnoreCase"]}