{"identifier": "getLegendItems", "parameters": "()", "modifiers": "public", "return": "LegendItemCollection", "body": "public LegendItemCollection getLegendItems() {\n\n        LegendItemCollection result = new LegendItemCollection();\n\n        if (this.dataset != null) {\n            List keys = null;\n\n            prefetchSectionPaints();\n            if (this.dataExtractOrder == TableOrder.BY_ROW) {\n                keys = this.dataset.getColumnKeys();\n            }\n            else if (this.dataExtractOrder == TableOrder.BY_COLUMN) {\n                keys = this.dataset.getRowKeys();\n            }\n\n            if (keys != null) {\n                int section = 0;\n                Iterator iterator = keys.iterator();\n                while (iterator.hasNext()) {\n                    Comparable key = (Comparable) iterator.next();\n                    String label = key.toString();\n                    String description = label;\n                    Paint paint = (Paint) this.sectionPaints.get(key);\n                    LegendItem item = new LegendItem(label, description,\n                            null, null, Plot.DEFAULT_LEGEND_ITEM_CIRCLE,\n                            paint, Plot.DEFAULT_OUTLINE_STROKE, paint);\n                    item.setDataset(getDataset());\n                    result.add(item);\n                    section++;\n                }\n            }\n            if (this.limit > 0.0) {\n                result.add(new LegendItem(this.aggregatedItemsKey.toString(),\n                        this.aggregatedItemsKey.toString(), null, null,\n                        Plot.DEFAULT_LEGEND_ITEM_CIRCLE,\n                        this.aggregatedItemsPaint,\n                        Plot.DEFAULT_OUTLINE_STROKE,\n                        this.aggregatedItemsPaint));\n            }\n        }\n        return result;\n    }", "class": "MultiplePiePlot", "signature": "LegendItemCollection getLegendItems()", "full_signature": "public LegendItemCollection getLegendItems()", "class_method_signature": "MultiplePiePlot.getLegendItems()", "testcase": false, "constructor": false, "invocations": ["prefetchSectionPaints", "getColumnKeys", "getRowKeys", "iterator", "hasNext", "next", "toString", "get", "setDataset", "getDataset", "add", "add", "toString", "toString"]}