{"identifier": "create", "parameters": "(String opt)", "modifiers": "public static", "return": "Option", "body": "public static Option create(String opt) throws IllegalArgumentException\n    {\n        Option option = null;\n        try {\n            // create the option\n            option = new Option(opt, description);\n\n            // set the option properties\n            option.setLongOpt(longopt);\n            option.setRequired(required);\n            option.setOptionalArg(optionalArg);\n            option.setArgs(numberOfArgs);\n            option.setType(type);\n            option.setValueSeparator(valuesep);\n            option.setArgName(argName);\n        } finally {\n            // reset the OptionBuilder properties\n            OptionBuilder.reset();\n        }\n\n        // return the Option instance\n        return option;\n    }", "class": "OptionBuilder", "signature": "Option create(String opt)", "full_signature": "public static Option create(String opt)", "class_method_signature": "OptionBuilder.create(String opt)", "testcase": false, "constructor": false, "invocations": ["setLongOpt", "setRequired", "setOptionalArg", "setArgs", "setType", "setValueSeparator", "setArgName", "reset"]}