{"identifier": "drawDomainMarker", "parameters": "(Graphics2D g2,\n                                 CategoryPlot plot,\n                                 CategoryAxis axis,\n                                 CategoryMarker marker,\n                                 Rectangle2D dataArea)", "modifiers": "public", "return": "void", "body": "public void drawDomainMarker(Graphics2D g2,\n                                 CategoryPlot plot,\n                                 CategoryAxis axis,\n                                 CategoryMarker marker,\n                                 Rectangle2D dataArea) {\n\n        Comparable category = marker.getKey();\n        CategoryDataset dataset = plot.getDataset(plot.getIndexOf(this));\n        int columnIndex = dataset.getColumnIndex(category);\n        if (columnIndex < 0) {\n            return;\n        }\n\n        final Composite savedComposite = g2.getComposite();\n        g2.setComposite(AlphaComposite.getInstance(\n                AlphaComposite.SRC_OVER, marker.getAlpha()));\n\n        PlotOrientation orientation = plot.getOrientation();\n        Rectangle2D bounds = null;\n        if (marker.getDrawAsLine()) {\n            double v = axis.getCategoryMiddle(columnIndex,\n                    dataset.getColumnCount(), dataArea,\n                    plot.getDomainAxisEdge());\n            Line2D line = null;\n            if (orientation == PlotOrientation.HORIZONTAL) {\n                line = new Line2D.Double(dataArea.getMinX(), v,\n                        dataArea.getMaxX(), v);\n            }\n            else if (orientation == PlotOrientation.VERTICAL) {\n                line = new Line2D.Double(v, dataArea.getMinY(), v,\n                        dataArea.getMaxY());\n            }\n            g2.setPaint(marker.getPaint());\n            g2.setStroke(marker.getStroke());\n            g2.draw(line);\n            bounds = line.getBounds2D();\n        }\n        else {\n            double v0 = axis.getCategoryStart(columnIndex,\n                    dataset.getColumnCount(), dataArea,\n                    plot.getDomainAxisEdge());\n            double v1 = axis.getCategoryEnd(columnIndex,\n                    dataset.getColumnCount(), dataArea,\n                    plot.getDomainAxisEdge());\n            Rectangle2D area = null;\n            if (orientation == PlotOrientation.HORIZONTAL) {\n                area = new Rectangle2D.Double(dataArea.getMinX(), v0,\n                        dataArea.getWidth(), (v1 - v0));\n            }\n            else if (orientation == PlotOrientation.VERTICAL) {\n                area = new Rectangle2D.Double(v0, dataArea.getMinY(),\n                        (v1 - v0), dataArea.getHeight());\n            }\n            g2.setPaint(marker.getPaint());\n            g2.fill(area);\n            bounds = area;\n        }\n\n        String label = marker.getLabel();\n        RectangleAnchor anchor = marker.getLabelAnchor();\n        if (label != null) {\n            Font labelFont = marker.getLabelFont();\n            g2.setFont(labelFont);\n            g2.setPaint(marker.getLabelPaint());\n            Point2D coordinates = calculateDomainMarkerTextAnchorPoint(\n                    g2, orientation, dataArea, bounds, marker.getLabelOffset(),\n                    marker.getLabelOffsetType(), anchor);\n            TextUtilities.drawAlignedString(label, g2,\n                    (float) coordinates.getX(), (float) coordinates.getY(),\n                    marker.getLabelTextAnchor());\n        }\n        g2.setComposite(savedComposite);\n    }", "class": "AbstractCategoryItemRenderer", "signature": "void drawDomainMarker(Graphics2D g2,\n                                 CategoryPlot plot,\n                                 CategoryAxis axis,\n                                 CategoryMarker marker,\n                                 Rectangle2D dataArea)", "full_signature": "public void drawDomainMarker(Graphics2D g2,\n                                 CategoryPlot plot,\n                                 CategoryAxis axis,\n                                 CategoryMarker marker,\n                                 Rectangle2D dataArea)", "class_method_signature": "AbstractCategoryItemRenderer.drawDomainMarker(Graphics2D g2,\n                                 CategoryPlot plot,\n                                 CategoryAxis axis,\n                                 CategoryMarker marker,\n                                 Rectangle2D dataArea)", "testcase": false, "constructor": false, "invocations": ["getKey", "getDataset", "getIndexOf", "getColumnIndex", "getComposite", "setComposite", "getInstance", "getAlpha", "getOrientation", "getDrawAsLine", "getCategoryMiddle", "getColumnCount", "getDomainAxisEdge", "getMinX", "getMaxX", "getMinY", "getMaxY", "setPaint", "getPaint", "setStroke", "getStroke", "draw", "getBounds2D", "getCategoryStart", "getColumnCount", "getDomainAxisEdge", "getCategoryEnd", "getColumnCount", "getDomainAxisEdge", "getMinX", "getWidth", "getMinY", "getHeight", "setPaint", "getPaint", "fill", "getLabel", "getLabelAnchor", "getLabelFont", "setFont", "setPaint", "getLabelPaint", "calculateDomainMarkerTextAnchorPoint", "getLabelOffset", "getLabelOffsetType", "drawAlignedString", "getX", "getY", "getLabelTextAnchor", "setComposite"]}