{"identifier": "equals", "parameters": "(Object obj)", "modifiers": "public", "return": "boolean", "body": "public boolean equals(Object obj) {\n        if (obj == this) {\n            return true;\n        }\n        if (!(obj instanceof MultiplePiePlot)) {\n            return false;\n        }\n        MultiplePiePlot that = (MultiplePiePlot) obj;\n        if (this.dataExtractOrder != that.dataExtractOrder) {\n            return false;\n        }\n        if (this.limit != that.limit) {\n            return false;\n        }\n        if (!this.aggregatedItemsKey.equals(that.aggregatedItemsKey)) {\n            return false;\n        }\n        if (!PaintUtilities.equal(this.aggregatedItemsPaint,\n                that.aggregatedItemsPaint)) {\n            return false;\n        }\n        if (!ObjectUtilities.equal(this.pieChart, that.pieChart)) {\n            return false;\n        }\n        if (!super.equals(obj)) {\n            return false;\n        }\n        return true;\n    }", "class": "MultiplePiePlot", "signature": "boolean equals(Object obj)", "full_signature": "public boolean equals(Object obj)", "class_method_signature": "MultiplePiePlot.equals(Object obj)", "testcase": false, "constructor": false, "invocations": ["equals", "equal", "equal", "equals"]}