{"identifier": "clone", "parameters": "()", "modifiers": "public", "return": "Object", "body": "public Object clone() throws CloneNotSupportedException {\n        PiePlot clone = (PiePlot) super.clone();\n        if (clone.dataset != null) {\n            clone.dataset.addChangeListener(clone);\n        }\n        if (this.urlGenerator instanceof PublicCloneable) {\n            clone.urlGenerator = (PieURLGenerator) ObjectUtilities.clone(\n                    this.urlGenerator);\n        }\n        clone.legendItemShape = ShapeUtilities.clone(this.legendItemShape);\n        if (this.legendLabelGenerator != null) {\n            clone.legendLabelGenerator = (PieSectionLabelGenerator) \n                    ObjectUtilities.clone(this.legendLabelGenerator);\n        }\n        if (this.legendLabelToolTipGenerator != null) {\n            clone.legendLabelToolTipGenerator = (PieSectionLabelGenerator) \n                    ObjectUtilities.clone(this.legendLabelToolTipGenerator);\n        }\n        if (this.legendLabelURLGenerator instanceof PublicCloneable) {\n            clone.legendLabelURLGenerator = (PieURLGenerator) \n                    ObjectUtilities.clone(this.legendLabelURLGenerator);\n        }\n        return clone;\n    }", "class": "PiePlot", "signature": "Object clone()", "full_signature": "public Object clone()", "class_method_signature": "PiePlot.clone()", "testcase": false, "constructor": false, "invocations": ["clone", "addChangeListener", "clone", "clone", "clone", "clone", "clone"]}