{"identifier": "getObject", "parameters": "(Comparable rowKey, Comparable columnKey)", "modifiers": "public", "return": "Object", "body": "public Object getObject(Comparable rowKey, Comparable columnKey) {\n        if (rowKey == null) {\n            throw new IllegalArgumentException(\"Null 'rowKey' argument.\");\n        }\n        if (columnKey == null) {\n            throw new IllegalArgumentException(\"Null 'columnKey' argument.\");\n        }\n        int row = this.rowKeys.indexOf(rowKey);\n        if (row < 0) {\n            throw new UnknownKeyException(\"Row key (\" + rowKey \n                    + \") not recognised.\");\n        }\n        int column = this.columnKeys.indexOf(columnKey);\n        if (column < 0) {\n            throw new UnknownKeyException(\"Column key (\" + columnKey \n                    + \") not recognised.\");\n        }\n        KeyedObjects rowData = (KeyedObjects) this.rows.get(row);\n        int index = rowData.getIndex(columnKey);\n        if (index >= 0) {\n            return rowData.getObject(index);\n        }\n        else {\n            return null;\n        }\n    }", "class": "KeyedObjects2D", "signature": "Object getObject(Comparable rowKey, Comparable columnKey)", "full_signature": "public Object getObject(Comparable rowKey, Comparable columnKey)", "class_method_signature": "KeyedObjects2D.getObject(Comparable rowKey, Comparable columnKey)", "testcase": false, "constructor": false, "invocations": ["indexOf", "indexOf", "get", "getIndex", "getObject"]}