{"identifier": "removeDomainMarker", "parameters": "(int index, Marker marker, Layer layer,\n            boolean notify)", "modifiers": "public", "return": "boolean", "body": "public boolean removeDomainMarker(int index, Marker marker, Layer layer,\n            boolean notify) {\n        ArrayList markers;\n        if (layer == Layer.FOREGROUND) {\n            markers = (ArrayList) this.foregroundDomainMarkers.get(\n                    new Integer(index));\n        }\n        else {\n            markers = (ArrayList) this.backgroundDomainMarkers.get(\n                    new Integer(index));\n        }\n        if (markers == null) {\n            return false;\n        }\n        boolean removed = markers.remove(marker);\n        if (removed && notify) {\n            fireChangeEvent();\n        }\n        return removed;\n    }", "class": "XYPlot", "signature": "boolean removeDomainMarker(int index, Marker marker, Layer layer,\n            boolean notify)", "full_signature": "public boolean removeDomainMarker(int index, Marker marker, Layer layer,\n            boolean notify)", "class_method_signature": "XYPlot.removeDomainMarker(int index, Marker marker, Layer layer,\n            boolean notify)", "testcase": false, "constructor": false, "invocations": ["get", "get", "remove", "fireChangeEvent"]}