{"identifier": "equals", "parameters": "(Object obj)", "modifiers": "public", "return": "boolean", "body": "public boolean equals(Object obj) {\n\n        if (obj == this) {\n            return true;\n        }\n        if (!(obj instanceof AbstractCategoryItemRenderer)) {\n            return false;\n        }\n        AbstractCategoryItemRenderer that = (AbstractCategoryItemRenderer) obj;\n\n        if (!ObjectUtilities.equal(this.itemLabelGeneratorList,\n                that.itemLabelGeneratorList)) {\n            return false;\n        }\n        if (!ObjectUtilities.equal(this.baseItemLabelGenerator,\n                that.baseItemLabelGenerator)) {\n            return false;\n        }\n        if (!ObjectUtilities.equal(this.toolTipGeneratorList,\n                that.toolTipGeneratorList)) {\n            return false;\n        }\n        if (!ObjectUtilities.equal(this.baseToolTipGenerator,\n                that.baseToolTipGenerator)) {\n            return false;\n        }\n        if (!ObjectUtilities.equal(this.urlGeneratorList,\n                that.urlGeneratorList)) {\n            return false;\n        }\n        if (!ObjectUtilities.equal(this.baseURLGenerator,\n                that.baseURLGenerator)) {\n            return false;\n        }\n        if (!ObjectUtilities.equal(this.legendItemLabelGenerator,\n                that.legendItemLabelGenerator)) {\n            return false;\n        }\n        if (!ObjectUtilities.equal(this.legendItemToolTipGenerator,\n                that.legendItemToolTipGenerator)) {\n            return false;\n        }\n        if (!ObjectUtilities.equal(this.legendItemURLGenerator,\n                that.legendItemURLGenerator)) {\n            return false;\n        }\n        if (!ObjectUtilities.equal(this.backgroundAnnotations,\n                that.backgroundAnnotations)) {\n            return false;\n        }\n        if (!ObjectUtilities.equal(this.foregroundAnnotations,\n                that.foregroundAnnotations)) {\n            return false;\n        }\n        return super.equals(obj);\n    }", "class": "AbstractCategoryItemRenderer", "signature": "boolean equals(Object obj)", "full_signature": "public boolean equals(Object obj)", "class_method_signature": "AbstractCategoryItemRenderer.equals(Object obj)", "testcase": false, "constructor": false, "invocations": ["equal", "equal", "equal", "equal", "equal", "equal", "equal", "equal", "equal", "equal", "equal", "equals"]}