{"identifier": "zoomDomainAxes", "parameters": "(double factor, PlotRenderingInfo info,\n                               Point2D source, boolean useAnchor)", "modifiers": "public", "return": "void", "body": "public void zoomDomainAxes(double factor, PlotRenderingInfo info,\n                               Point2D source, boolean useAnchor) {\n                \n        // perform the zoom on each domain axis\n        for (int i = 0; i < this.domainAxes.size(); i++) {\n            ValueAxis domainAxis = (ValueAxis) this.domainAxes.get(i);\n            if (domainAxis != null) {\n                if (useAnchor) {\n                    // get the relevant source coordinate given the plot \n                    // orientation\n                    double sourceX = source.getX();\n                    if (this.orientation == PlotOrientation.HORIZONTAL) {\n                        sourceX = source.getY();\n                    }\n                    double anchorX = domainAxis.java2DToValue(sourceX, \n                            info.getDataArea(), getDomainAxisEdge());\n                    domainAxis.resizeRange(factor, anchorX);\n                }\n                else {\n                    domainAxis.resizeRange(factor);\n                }\n            }\n        }\n    }", "class": "XYPlot", "signature": "void zoomDomainAxes(double factor, PlotRenderingInfo info,\n                               Point2D source, boolean useAnchor)", "full_signature": "public void zoomDomainAxes(double factor, PlotRenderingInfo info,\n                               Point2D source, boolean useAnchor)", "class_method_signature": "XYPlot.zoomDomainAxes(double factor, PlotRenderingInfo info,\n                               Point2D source, boolean useAnchor)", "testcase": false, "constructor": false, "invocations": ["size", "get", "getX", "getY", "java2DToValue", "getDataArea", "getDomainAxisEdge", "resizeRange", "resizeRange"]}