{"identifier": "drawDomainTickBands", "parameters": "(Graphics2D g2, Rectangle2D dataArea,\n                                    List ticks)", "modifiers": "public", "return": "void", "body": "public void drawDomainTickBands(Graphics2D g2, Rectangle2D dataArea,\n                                    List ticks) {\n        Paint bandPaint = getDomainTickBandPaint();\n        if (bandPaint != null) {\n            boolean fillBand = false;\n            ValueAxis xAxis = getDomainAxis();\n            double previous = xAxis.getLowerBound();\n            Iterator iterator = ticks.iterator();\n            while (iterator.hasNext()) {\n                ValueTick tick = (ValueTick) iterator.next();\n                double current = tick.getValue();\n                if (fillBand) {\n                    getRenderer().fillDomainGridBand(g2, this, xAxis, dataArea,\n                            previous, current);\n                }\n                previous = current;\n                fillBand = !fillBand;\n            }\n            double end = xAxis.getUpperBound();\n            if (fillBand) {\n                getRenderer().fillDomainGridBand(g2, this, xAxis, dataArea, \n                        previous, end);\n            }\n        }\n    }", "class": "XYPlot", "signature": "void drawDomainTickBands(Graphics2D g2, Rectangle2D dataArea,\n                                    List ticks)", "full_signature": "public void drawDomainTickBands(Graphics2D g2, Rectangle2D dataArea,\n                                    List ticks)", "class_method_signature": "XYPlot.drawDomainTickBands(Graphics2D g2, Rectangle2D dataArea,\n                                    List ticks)", "testcase": false, "constructor": false, "invocations": ["getDomainTickBandPaint", "getDomainAxis", "getLowerBound", "iterator", "hasNext", "next", "getValue", "fillDomainGridBand", "getRenderer", "getUpperBound", "fillDomainGridBand", "getRenderer"]}