{"identifier": "setRenderer", "parameters": "(int index, CategoryItemRenderer renderer, \n                            boolean notify)", "modifiers": "public", "return": "void", "body": "public void setRenderer(int index, CategoryItemRenderer renderer, \n                            boolean notify) {\n        \n        // stop listening to the existing renderer...\n        CategoryItemRenderer existing \n            = (CategoryItemRenderer) this.renderers.get(index);\n        if (existing != null) {\n            existing.removeChangeListener(this);\n        }\n        \n        // register the new renderer...\n        this.renderers.set(index, renderer);\n        if (renderer != null) {\n            renderer.setPlot(this);\n            renderer.addChangeListener(this);\n        }\n        \n        configureDomainAxes();\n        configureRangeAxes();\n        \n        if (notify) {\n            fireChangeEvent();\n        }\n    }", "class": "CategoryPlot", "signature": "void setRenderer(int index, CategoryItemRenderer renderer, \n                            boolean notify)", "full_signature": "public void setRenderer(int index, CategoryItemRenderer renderer, \n                            boolean notify)", "class_method_signature": "CategoryPlot.setRenderer(int index, CategoryItemRenderer renderer, \n                            boolean notify)", "testcase": false, "constructor": false, "invocations": ["get", "removeChangeListener", "set", "setPlot", "addChangeListener", "configureDomainAxes", "configureRangeAxes", "fireChangeEvent"]}