{"identifier": "createBigDecimal", "parameters": "(String str)", "modifiers": "public static", "return": "BigDecimal", "body": "public static BigDecimal createBigDecimal(String str) {\n        if (str == null) {\n            return null;\n        }\n        // handle JDK1.3.1 bug where \"\" throws IndexOutOfBoundsException\n        if (StringUtils.isBlank(str)) {\n            throw new NumberFormatException(\"A blank string is not a valid number\");\n        }\n        if (str.trim().startsWith(\"--\")) {\n            // this is protection for poorness in java.lang.BigDecimal.\n            // it accepts this as a legal value, but it does not appear \n            // to be in specification of class. OS X Java parses it to \n            // a wrong value.\n            throw new NumberFormatException(str + \" is not a valid number.\");\n        }\n        return new BigDecimal(str);\n    }", "class": "NumberUtils", "signature": "BigDecimal createBigDecimal(String str)", "full_signature": "public static BigDecimal createBigDecimal(String str)", "class_method_signature": "NumberUtils.createBigDecimal(String str)", "testcase": false, "constructor": false, "invocations": ["isBlank", "startsWith", "trim"]}