{"identifier": "getLegendItems", "parameters": "()", "modifiers": "public", "return": "LegendItemCollection", "body": "public LegendItemCollection getLegendItems() {\n\n        LegendItemCollection result = new LegendItemCollection();\n        if (this.dataset == null) {\n            return result;\n        }\n        List keys = this.dataset.getKeys();\n        int section = 0;\n        Shape shape = getLegendItemShape();\n        Iterator iterator = keys.iterator();\n        while (iterator.hasNext()) {\n            Comparable key = (Comparable) iterator.next();\n            Number n = this.dataset.getValue(key);\n            boolean include = true;\n            if (n == null) {\n                include = !this.ignoreNullValues;   \n            }\n            else {\n                double v = n.doubleValue();\n                if (v == 0.0) {\n                    include = !this.ignoreZeroValues;   \n                }\n                else {\n                    include = v > 0.0;   \n                }\n            }\n            if (include) {\n                String label = this.legendLabelGenerator.generateSectionLabel(\n                        this.dataset, key);\n                if (label != null) {\n                    String description = label;\n                    String toolTipText = null;\n                    if (this.legendLabelToolTipGenerator != null) {\n                        toolTipText = this.legendLabelToolTipGenerator\n                                .generateSectionLabel(this.dataset, key);\n                    }\n                    String urlText = null;\n                    if (this.legendLabelURLGenerator != null) {\n                        urlText = this.legendLabelURLGenerator.generateURL(\n                                this.dataset, key, this.pieIndex);\n                    }\n                    Paint paint = lookupSectionPaint(key, true);\n                    Paint outlinePaint = lookupSectionOutlinePaint(key);\n                    Stroke outlineStroke = lookupSectionOutlineStroke(key);\n                    LegendItem item = new LegendItem(label, description, \n                            toolTipText, urlText, true, shape, true, paint, \n                            true, outlinePaint, outlineStroke, \n                            false,          // line not visible\n                            new Line2D.Float(), new BasicStroke(), Color.black);\n                    item.setDataset(getDataset());\n                    result.add(item);\n                }\n                section++;\n            }\n            else {\n                section++;\n            }\n        }\n        return result;\n    }", "class": "PiePlot", "signature": "LegendItemCollection getLegendItems()", "full_signature": "public LegendItemCollection getLegendItems()", "class_method_signature": "PiePlot.getLegendItems()", "testcase": false, "constructor": false, "invocations": ["getKeys", "getLegendItemShape", "iterator", "hasNext", "next", "getValue", "doubleValue", "generateSectionLabel", "generateSectionLabel", "generateURL", "lookupSectionPaint", "lookupSectionOutlinePaint", "lookupSectionOutlineStroke", "setDataset", "getDataset", "add"]}